galContentId,galTitle,galWebImageUrl,galSearchKeyword,processedLocation,galPhotographyLocation
2609595,장충동 족발골목,http://tong.visitkorea.or.kr/cms2/website/95/2609595.jpg,"장충동 족발골목, 서울특별시 중구, 맛골목, 음식테마거리, 음식거리, 한식, 음식",서울특별시 중구,서울특별시 중구 장충동
2609544,용두동 주꾸미골목,http://tong.visitkorea.or.kr/cms2/website/44/2609544.jpg,"용두동 주꾸미골목, 서울특별시 동대문구, 맛골목, 음식테마거리, 음식거리, 용두동 주꾸미 특화거리, 용두동 쭈꾸미골목, 용두동 쭈꾸미 특화거리",서울특별시 동대문구,서울특별시 동대문구 용두동
2609524,왕십리 곱창거리,http://tong.visitkorea.or.kr/cms2/website/24/2609524.jpg,"왕십리 곱창거리, 서울특별시 성동구, 맛골목, 음식테마거리, 음식거리",서울특별시 성동구,서울특별시 성동구 행당동
2609513,신사동 아귀찜골목,http://tong.visitkorea.or.kr/cms2/website/13/2609513.jpg,"신사동 아귀찜골목, 서울특별시 서초구, 맛골목, 음식테마거리, 음식거리, 신사동 아구찜골목",서울특별시 서초구,서울특별시 서초구 잠원동
2609497,신림동 순대타운,http://tong.visitkorea.or.kr/cms2/website/97/2609497.jpg,"신림동 순대타운, 서울특별시 관악구, 맛골목, 음식테마거리, 음식거리, 원조민속순대타운",서울특별시 관악구,서울특별시 관악구 신림동
2609484,신당동떡볶이타운,http://tong.visitkorea.or.kr/cms2/website/84/2609484.jpg,"신당동 떡볶이타운, 서울특별시 중구, 맛골목, 음식테마거리, 음식거리, 신당동 떡볶이 거리",서울특별시 중구,서울특별시 중구 신당동
2609468,마포 돼지갈비거리,http://tong.visitkorea.or.kr/cms2/website/68/2609468.jpg,"마포 돼지갈비거리, 서울특별시 마포구, 맛골목, 음식테마거리, 음식거리, 마포용강 맛깨비길, 마포음식문화거리",서울특별시 마포구,서울특별시 마포구 합정동
2609288,마장동 먹자골목,http://tong.visitkorea.or.kr/cms2/website/88/2609288.jpg,"마장동 먹자골목, 서울특별시 성동구, 맛골목, 음식테마거리, 음식거리, 고기집, 고깃집, 한식, 음식, 한우, 소고기, 화로, 숯불",서울특별시 성동구,서울특별시 성동구 마장동
2609099,인천 화평동 냉면거리,http://tong.visitkorea.or.kr/cms2/website/99/2609099.jpg,"인천 화평동 냉면거리, 인천광역시 동구, 맛골목, 음식테마거리, 음식거리",인천광역시 동구,인천광역시 동구 화평동
2608931,부산 팥빙수 단팥죽골목,http://tong.visitkorea.or.kr/cms2/website/31/2608931.jpg,"부산 팥빙수 단팥죽골목, 부산광역시 중구, 맛골목, 음식테마거리, 음식거리, 부산국제시장",부산광역시 중구,부산광역시 중구 부평동
2608908,부산 온천장 곰장어골목,http://tong.visitkorea.or.kr/cms2/website/08/2608908.jpg,"부산 온천장 곰장어골목, 부산광역시 동래구, 맛골목, 음식테마거리, 음식거리, 온천장 꼼장어골목, 한식, 음식, 곰장어구이, 꼼장어구이",부산광역시 동래구,부산광역시 동래구 온천동
2608552,대구 동인찜갈비골목,http://tong.visitkorea.or.kr/cms2/website/52/2608552.jpg,"대구 동인찜갈비골목, 대구광역시 중구, 맛골목, 음식테마거리, 음식거리, 대구 동인동 찜갈비, 한식, 음식, 양푼이갈비찜, 양은냄비",대구광역시 중구,대구광역시 중구 동인동
2608699,대구 평화시장 닭똥집골목,http://tong.visitkorea.or.kr/cms2/website/99/2608699.jpg,"대구 평화시장 닭똥집골목, 대구광역시 동구, 맛골목, 음식테마거리, 음식거리, 닭똥집 명물거리, 한식, 음식, 닭똥집튀김, 닭 모래주머니, 닭 근위",대구광역시 동구,대구광역시 동구 신암동
2608752,부산 서면향토음식특화거리,http://tong.visitkorea.or.kr/cms2/website/52/2608752.jpg,"부산 서면향토음식특화거리, 부산광역시 부산진구, 맛골목, 음식테마거리, 음식거리",부산광역시 부산진구,부산광역시 부산진구 부전동
2608734,민락동 횟집거리,http://tong.visitkorea.or.kr/cms2/website/34/2608734.jpg,"민락동 횟집거리, 부산광역시 수영구, 맛골목, 음식테마거리, 음식거리, 광안리 회센터, 횟집, 민락회타운",부산광역시 수영구,부산광역시 수영구 민락동
2638137,2019 진해군항제,http://tong.visitkorea.or.kr/cms2/website/37/2638137.jpg,"2019 진해군항제 야경, 경상남도 창원시, 2019 상반기 기획사진, 봄, 벚꽃축제, 벚나무, 기차",경상남도 창원시,경상남도 창원시 진해구
2638079,2019 제천 청풍호 벚꽃축제,http://tong.visitkorea.or.kr/cms2/website/79/2638079.jpg,"2019 제천 청풍호 벚꽃축제, 충청북도 제천시, 2019 상반기 기획사진, 벚나무, 봄, 벚꽃길, 청풍호, 드라이브 코스, 드론촬영, 드론사진, 항공촬영, 파노라마",충청북도 제천시,충청북도 제천시
2638059,2019 영등포 여의도 봄꽃축제,http://tong.visitkorea.or.kr/cms2/website/59/2638059.jpg,"2019 영등포 여의도 봄꽃축제, 서울특별시 영등포구, 2019 상반기 기획사진, 윤중로 벚꽃길, 벚나무, 드론촬영, 드론사진, 항공촬영, 파노라마",서울특별시 영등포구,서울특별시 영등포구
2637982,여수 영취산,http://tong.visitkorea.or.kr/cms2/website/82/2637982.jpg,"여수 영취산, 전라남도 여수시, 2019 상반기 기획사진, 진달래, 참꽃, 봄, 드론촬영, 드론사진, 항공촬영, 파노라마",전라남도 여수시,전라남도 여수시 중흥동
2637875,산방산,http://tong.visitkorea.or.kr/cms2/website/75/2637875.jpg,"산방산, 제주특별자치도 서귀포시, 제주도, 2019 상반기 기획사진, 화산섬, 봄, 유채꽃, 드론촬영, 드론사진, 항공촬영, 파노라마",제주특별자치도 서귀포시,제주특별자치도 서귀포시 안덕면
2637870,비슬산,http://tong.visitkorea.or.kr/cms2/website/70/2637870.jpg,"비슬산, 대구광역시 달성군, 2019 상반기 기획사진, 참꽃문화제, 봄, 진달래, 드론촬영, 드론사진, 항공촬영, 파노라마",대구광역시 달성군,대구광역시 달성군 유가읍
2637845,보문정,http://tong.visitkorea.or.kr/cms2/website/45/2637845.jpg,"보문정, 경상북도 경주시, 2019 상반기 기획사진, 경주보문관광단지, 연못, 정자, 봄, 벚꽃, 벚나무, 드론촬영, 드론사진, 항공촬영, 파노라마",경상북도 경주시,경상북도 경주시 신평동
2637829,녹산로 유채꽃도로,http://tong.visitkorea.or.kr/cms2/website/29/2637829.jpg,"녹산로 유채꽃도로, 제주특별자치도 서귀포시, 제주도, 2019 상반기 기획사진, 가시리 유채꽃도로, 가시리 녹산로 유채꽃도로, 녹산로 벚꽃길, 가시리 벚꽃길, 드라이브 코스, 봄",제주특별자치도 서귀포시,제주특별자치도 서귀포시 표선면
2637841,벚꽃,http://tong.visitkorea.or.kr/cms2/website/41/2637841.jpg,"벚꽃, 경상북도 경주시, 2019 상반기 기획사진, 벚나무, 봄",경상북도 경주시,경상북도 경주시
2637825,구례 섬진강 벚꽃길,http://tong.visitkorea.or.kr/cms2/website/25/2637825.jpg,"구례 섬진강 벚꽃길, 전라남도 구례군, 2019 상반기 기획사진, 섬진강변 벚꽃축제, 봄, 벚나무, 구례10경, 구례십경, 드라이브 코스, 드론촬영, 드론사진, 항공촬영, 파노라마",전라남도 구례군,전라남도 구례군
2637557,고려산,http://tong.visitkorea.or.kr/cms2/website/57/2637557.jpg,"고려산, 인천광역시 강화군, 2019 상반기 기획사진, 진달래, 참꽃, 봄, 드론촬영, 드론사진, 항공촬영, 파노라마",인천광역시 강화군,인천광역시 강화군 내가면
2610285,한림공원,http://tong.visitkorea.or.kr/cms2/website/85/2610285.jpg,"한림공원, 제주특별자치도 제주시, 제주도",제주특별자치도 제주시,제주특별자치도 제주시 한림읍
2610196,제주 중문관광단지,http://tong.visitkorea.or.kr/cms2/website/96/2610196.jpg,"제주 중문관광단지, 제주특별자치도 서귀포시, 제주도, 드론촬영, 드론사진, 항공촬영",제주특별자치도 서귀포시,제주특별자치도 서귀포시
2610179,오라동 청보리밭,http://tong.visitkorea.or.kr/cms2/website/79/2610179.jpg,"오라동 청보리밭, 제주특별자치도 제주시, 제주도 전경",제주특별자치도 제주시,제주특별자치도 제주시 오라동
2610176,엉덩물계곡,http://tong.visitkorea.or.kr/cms2/website/76/2610176.jpg,"엉덩물계곡, 제주특별자치도 서귀포시, 제주도, 유채꽃밭, 드론촬영, 드론사진, 항공촬영",제주특별자치도 서귀포시,제주특별자치도 서귀포시 안덕면
2610152,도두동 무지개 해안도로,http://tong.visitkorea.or.kr/cms2/website/52/2610152.jpg,"도두동 무지개 해안도로, 제주특별자치도 제주시, 제주도, 도두 무지개도로, 도두 해안도로",제주특별자치도 제주시,제주특별자치도 제주시 도두동
2610128,다랑쉬오름,http://tong.visitkorea.or.kr/cms2/website/28/2610128.jpg,"다랑쉬오름, 제주특별자치도 제주시, 제주도, 월랑봉, 분화구, 제주오름, 제주도 전경, 드론촬영, 드론사진, 항공촬영",제주특별자치도 제주시,제주특별자치도 제주시 구좌읍
2609908,제주 흑돼지거리,http://tong.visitkorea.or.kr/cms2/website/08/2609908.jpg,"제주 흑돼지거리, 제주특별자치도 제주시, 제주도, 맛골목, 음식테마거리, 음식거리",제주특별자치도 제주시,제주특별자치도 제주시 삼도동
2609899,제주 칠십리음식특화거리,http://tong.visitkorea.or.kr/cms2/website/99/2609899.jpg,"제주 칠십리음식특화거리, 제주특별자치도 서귀포시, 제주도, 맛골목, 음식테마거리, 음식거리",제주특별자치도 서귀포시,제주특별자치도 서귀포시 서귀동
2604790,안면도 쥬라기박물관,http://tong.visitkorea.or.kr/cms2/website/90/2604790.jpg,"안면도 쥬라기 박물관, 충청남도 태안군, 안면도 쥬라기공원, 공룡",충청남도 태안군,충청남도 태안군 남면
2604673,한국 DMZ 평화생명동산,http://tong.visitkorea.or.kr/cms2/website/73/2604673.jpg,"한국 DMZ 평화생명동산 교육마을, 강원도 인제군, DMZ 관광, DMZ 투어, 안보관광지, 박물관",강원도 인제군,강원도 인제군 서화면
2604645,대전예술의전당,http://tong.visitkorea.or.kr/cms2/website/45/2604645.jpg,"대전예술의전당, 대전광역시 서구, 종합공연장, 전시장",대전광역시 서구,대전광역시 서구 만년동
2604644,대전엑스포시민광장,http://tong.visitkorea.or.kr/cms2/website/44/2604644.jpg,"대전엑스포시민광장, 대전광역시 서구",대전광역시 서구,대전광역시 서구 만년동
2604520,대전시립미술관,http://tong.visitkorea.or.kr/cms2/website/20/2604520.jpg,"대전시립미술관, 대전광역시 서구, 대전광역시립미술관, 갤러리",대전광역시 서구,대전광역시 서구 만년동
2604518,대전 엑스포다리,http://tong.visitkorea.or.kr/cms2/website/18/2604518.jpg,"대전 엑스포다리, 대전광역시 유성구, 한빛탑",대전광역시 유성구,대전광역시 유성구 도룡동
2604248,이승만별장(고성),http://tong.visitkorea.or.kr/cms2/website/48/2604248.jpg,"이승만별장(고성), 강원도 고성군, DMZ 관광, DMZ 투어, 안보관광지, 이승만대통령 별장",강원도 고성군,강원도 고성군 현내면
2604238,이기붕별장,http://tong.visitkorea.or.kr/cms2/website/38/2604238.jpg,"이기붕별장, 강원도 고성군, DMZ 관광, DMZ 투어, 안보관광지",강원도 고성군,강원도 고성군 거진읍
2601294,동대문 닭한마리 골목,http://tong.visitkorea.or.kr/cms2/website/94/2601294.jpg,"동대문 닭한마리 골목, 서울특별시 종로구, 이색거리, 음식점, 식당",서울특별시 종로구,서울특별시 종로구
2606295,목포근대역사관(구 목포일본영사관),http://tong.visitkorea.or.kr/cms2/website/95/2606295.jpg,"목포근대역사관(구 목포일본영사관), 전라남도 목포시, 사적 제289호, 목포근대역사문화공간, 박물관, 전시관",전라남도 목포시,전라남도 목포시 대의동
2607097,함평 양서 파충류 생태공원,http://tong.visitkorea.or.kr/cms2/website/97/2607097.jpg,"함평 양서 파충류 생태공원, 전라남도 함평군, 전시관",전라남도 함평군,전라남도 함평군 신광면
2607003,초의선사탄생지,http://tong.visitkorea.or.kr/cms2/website/03/2607003.jpg,"초의선사탄생지, 전라남도 무안군",전라남도 무안군,전라남도 무안군 삼향읍
2606901,밀리터리테마파크,http://tong.visitkorea.or.kr/cms2/website/01/2606901.jpg,"밀리터리테마파크, 전라남도 무안군, 병영체험, 체험관광지",전라남도 무안군,전라남도 무안군 몽탄면
2606739,분청사기명장전시관,http://tong.visitkorea.or.kr/cms2/website/39/2606739.jpg,"분청사기명장전시관, 전라남도 무안군, 가마",전라남도 무안군,전라남도 무안군 몽탄면
2606707,톱머리해수욕장,http://tong.visitkorea.or.kr/cms2/website/07/2606707.jpg,"톱머리해수욕장, 전라남도 무안군, 톱머리해변, 톱머리방파제, 등대",전라남도 무안군,전라남도 무안군 망운면
2606702,무안낙지골목,http://tong.visitkorea.or.kr/cms2/website/02/2606702.jpg,"무안낙지골목, 전라남도 무안군, 무안갯벌낙지, 거리풍경",전라남도 무안군,전라남도 무안군 무안읍
2606701,무안 식영정,http://tong.visitkorea.or.kr/cms2/website/01/2606701.jpg,"무안 식영정, 전라남도 무안군, 정자, 한옥",전라남도 무안군,전라남도 무안군 몽탄면
2606602,목포진역사공원,http://tong.visitkorea.or.kr/cms2/website/02/2606602.jpg,"목포진역사공원, 전라남도 목포시",전라남도 목포시,전라남도 목포시 만호동
2606422,목포요트마리나,http://tong.visitkorea.or.kr/cms2/website/22/2606422.jpg,"목포요트마리나, 전라남도 목포시, 배",전라남도 목포시,전라남도 목포시 산정동
2606363,목포연안여객선터미널,http://tong.visitkorea.or.kr/cms2/website/63/2606363.jpg,"목포연안여객선터미널, 전라남도 목포시, 배, 선박, 항구, 교통시설",전라남도 목포시,전라남도 목포시 항동
2606339,목포어린이바다과학관,http://tong.visitkorea.or.kr/cms2/website/39/2606339.jpg,"목포어린이바다과학관, 전라남도 목포시, 전시관, 등대체험학습장",전라남도 목포시,전라남도 목포시 산정동
2606260,목포근대역사관(구 동양척식주식회사 목포지점),http://tong.visitkorea.or.kr/cms2/website/60/2606260.jpg,"목포근대역사관(구 동양척식주식회사 목포지점), 전라남도 목포시, 목포근대역사문화공간, 박물관, 전시관, 전시실",전라남도 목포시,전라남도 목포시 중앙동
2606197,국립해양유물전시관,http://tong.visitkorea.or.kr/cms2/website/97/2606197.jpg,"해양유물전시관, 전라남도 목포시, 박물관, 전시실",전라남도 목포시,전라남도 목포시 용해동
2598116,고소 천사벽화마을,http://tong.visitkorea.or.kr/cms2/website/16/2598116.jpg,"오동도, 전라남도 여수시, 동백섬, 꽃섬, 여수팔경, 여수 8경, 바다, 방파제",전라남도 여수시,전라남도 여수시 수정동
2602046,머체왓숲길,http://tong.visitkorea.or.kr/cms2/website/46/2602046.jpg,"머체왓숲길, 제주특별자치도 서귀포시, 제주도, 유채꽃밭",제주특별자치도 서귀포시,제주특별자치도 서귀포시 남원읍
2602041,단산(바굼지오름),http://tong.visitkorea.or.kr/cms2/website/41/2602041.jpg,"단산(바굼지오름), 제주특별자치도 서귀포시, 제주도, 기생화산",제주특별자치도 서귀포시,제주특별자치도 서귀포시 안덕면
2602035,조랑말체험공원,http://tong.visitkorea.or.kr/cms2/website/35/2602035.jpg,"조랑말체험공원, 제주특별자치도 서귀포시, 제주도, 유채꽃밭, 풍력발전기",제주특별자치도 서귀포시,제주특별자치도 서귀포시 표선면
2599255,황순원문학촌 소나기마을,http://tong.visitkorea.or.kr/cms2/website/55/2599255.jpg,"황순원문학촌 소나기마을, 경기도 양평군, 민속마을",경기도 양평군,경기도 양평군 서종면
2598379,청남대,http://tong.visitkorea.or.kr/cms2/website/79/2598379.jpg,"청남대, 충청북도 청주시, 대통령 전용별장, 대통령 별장, 청남대 산책로, 청남대 산책길, 솔숲, 소나무 숲, 송림",충청북도 청주시,충청북도 청주시 상당구
2598358,문의문화재단지,http://tong.visitkorea.or.kr/cms2/website/58/2598358.jpg,"문의문화재단지, 충청북도 청주시, 체험마을, 민속마을",충청북도 청주시,충청북도 청주시 상당구
2598336,말미장터마을,http://tong.visitkorea.or.kr/cms2/website/36/2598336.jpg,"말미장터마을, 출청북도 청주시",충청북도 청주시,충청북도 청주시 상당구
2598293,만해마을,http://tong.visitkorea.or.kr/cms2/website/93/2598293.jpg,"동국대학교 만해마을, 강원도 인제군",강원도 인제군,강원도 인제군 북면
2598275,외고산 옹기마을,http://tong.visitkorea.or.kr/cms2/website/75/2598275.jpg,"외고산 옹기마을, 울산광역시 울주군, 체험마을",울산광역시 울주군,울산광역시 울주군 온양읍
2598140,오동도,http://tong.visitkorea.or.kr/cms2/website/40/2598140.jpg,"오동도, 전라남도 여수시, 동백섬, 꽃섬, 여수팔경, 여수 8경, 동백꽃, 동백나무",전라남도 여수시,전라남도 여수시 수정동
2596867,아산 지중해마을,http://tong.visitkorea.or.kr/cms2/website/67/2596867.jpg,"아산 지중해마을, 충청남도 아산시, 체험마을",충청남도 아산시,충청남도 아산시 탕정면
2596859,철도문화마을,http://tong.visitkorea.or.kr/cms2/website/59/2596859.jpg,"철도문화마을, 전라남도 순천시",전라남도 순천시,전라남도 순천시 조곡동
2596707,맹방 유채밭,http://tong.visitkorea.or.kr/cms2/website/07/2596707.jpg,"맹방 유채밭, 강원도 삼척시, 맹방유채꽃축제, 봄",강원도 삼척시,강원도 삼척시 근덕면
2596586,송정 그림책마을,http://tong.visitkorea.or.kr/cms2/website/86/2596586.jpg,"송정 그림책마을, 충청남도 부여군, 송정마을, 체험마을",충청남도 부여군,충청남도 부여군 양화면
2596558,부여 무량사,http://tong.visitkorea.or.kr/cms2/website/58/2596558.jpg,"부여 무량사, 충청남도 부여군, 절, 사찰, 종교, 불교, 부여 무량사 오층석탑, 보물 제185호, 부여 무량사 석등, 보물 제233호",충청남도 부여군,충청남도 부여군 외산면
2596532,아미동 비석문화마을,http://tong.visitkorea.or.kr/cms2/website/32/2596532.jpg,"아미동 비석문화마을, 부산광역시 서구, 비석마을, 체험마을",부산광역시 서구,부산광역시 서구 아미동
2595996,경주 황남동 대형건물지,http://tong.visitkorea.or.kr/cms2/website/96/2595996.jpg,"경주 황남동 대형건물지, 경상북도 경주시, 릉, 고분, 무덤, 능",경상북도 경주시,경상북도 경주시 황남동
2595993,경주 주상절리 전망대,http://tong.visitkorea.or.kr/cms2/website/93/2595993.jpg,"경주 주상절리 전망대, 경상북도 경주시, 경주 양남 주상절리 전망대, 경주 양남 주상절리군, 천연기념물 제536호",경상북도 경주시,경상북도 경주시 양남면
2595977,경주 석빙고,http://tong.visitkorea.or.kr/cms2/website/77/2595977.jpg,"경주 석빙고, 경상북도 경주시, 보물 제66호, 얼음창고",경상북도 경주시,경상북도 경주시 인왕동
2595970,경주 교촌마을,http://tong.visitkorea.or.kr/cms2/website/70/2595970.jpg,"경주 교촌마을, 경상북도 경주시, 교촌한옥마을, 민속마을",경상북도 경주시,경상북도 경주시 교동
2601048,청와대 사랑채,http://tong.visitkorea.or.kr/cms2/website/48/2601048.jpg,"청와대 사랑채, 서울특별시 종로구, 전시관, 박물관",서울특별시 종로구,서울특별시 종로구 효자동
2600975,탑골공원,http://tong.visitkorea.or.kr/cms2/website/75/2600975.jpg,"탑골공원, 서울특별시 종로구, 사적 제354호, 3.1운동, 삼일독립운동, 국보 제2호, 서울 원각사지 십층석탑",서울특별시 종로구,서울특별시 종로구
2600966,케이스타일허브(K-Style HUB),http://tong.visitkorea.or.kr/cms2/website/66/2600966.jpg,"케이스타일허브(K-Style HUB), 서울특별시 중구, 전시관, 한국관광정보, 관광안내소, 한국관광공사 서울센터",서울특별시 중구,서울특별시 중구 다동
2600957,서대문형무소역사관,http://tong.visitkorea.or.kr/cms2/website/57/2600957.jpg,"서대문형무소역사관, 서울특별시 서대문구, 특수박물관, 사적 제324호, 서울 구 서대문형무소",서울특별시 서대문구,서울특별시 서대문구 현저동
2600897,천안 유관순 열사 유적,http://tong.visitkorea.or.kr/cms2/website/97/2600897.jpg,"천안 유관순 열사 유적, 충청남도 천안시, 사적 제230호, 만세",충청남도 천안시,충청남도 천안시 동남구
2600843,천안 광덕사,http://tong.visitkorea.or.kr/cms2/website/43/2600843.jpg,"천안 광덕사, 충청남도 천안시, 절, 사찰, 종교, 불교, 유형문화재 제120호, 광덕사 삼층석탑, 광덕사 3층석탑",충청남도 천안시,충청남도 천안시 동남구
2600820,유석 조병옥 박사 생가,http://tong.visitkorea.or.kr/cms2/website/20/2600820.jpg,"유석 조병옥 박사 생가, 충청남도 천안시",충청남도 천안시,충청남도 천안시 동남구
2600815,유관순열사 생가지,http://tong.visitkorea.or.kr/cms2/website/15/2600815.jpg,"유관순열사 생가지, 충청남도 천안시, 사적 제230호, 천안 유관순 열사 유적",충청남도 천안시,충청남도 천안시 동남구
2600804,아우내독립만세운동 기념공원,http://tong.visitkorea.or.kr/cms2/website/04/2600804.jpg,"아우내독립만세운동 기념공원, 충청남도 천안시, 아우내 장터 3.1운동 만세시위지",충청남도 천안시,충청남도 천안시 동남구
2600789,독립기념관,http://tong.visitkorea.or.kr/cms2/website/89/2600789.jpg,"독립기념관, 충청남도 천안시, 박물관, 학술전시관, 독립운동, 광개토대왕릉비, 비석",충청남도 천안시,충청남도 천안시 동남구
2600776,각원사,http://tong.visitkorea.or.kr/cms2/website/76/2600776.jpg,"각원사 전경, 충청남도 천안시, 태조산, 절, 사찰, 종교, 불교",충청남도 천안시,충청남도 천안시 동남구
2925827,가덕도 연대봉,http://tong.visitkorea.or.kr/cms2/website/27/2925827.jpg,"가덕도 연대봉, 부산광역시 강서구, 부산관광공사",부산광역시 강서구,부산광역시 강서구 천성동
2620319,추섬의 해돋이,http://tong.visitkorea.or.kr/cms2/website/19/2620319.jpg,"2019 제47회 대한민국 관광사진 공모전, 입선, 추섬의 해돋이, 경상남도 사천시, 일출",경상남도 사천시,경상남도 사천시
2710911,만경강,http://tong.visitkorea.or.kr/cms2/website/11/2710911.jpg,"만경강, 전라북도 전주시, 일몰, 석양, 낙조",전라북도 전주시,전라북도 전주시
2620271,용담호,http://tong.visitkorea.or.kr/cms2/website/71/2620271.jpg,"2019 제47회 대한민국 관광사진 공모전, 입선, 꿈속의 낙원, 전라북도 진안군, 용담호, 추경, 가을, 단풍",전라북도 진안군,전라북도 진안군 용담면
2620348,압해도의 여명,http://tong.visitkorea.or.kr/cms2/website/48/2620348.jpg,"2019 제47회 대한민국 관광사진 공모전, 입선, 압해도의 여명, 전라남도 신안군, 일몰",전라남도 신안군,전라남도 신안군
2620353,용아장성의 아침,http://tong.visitkorea.or.kr/cms2/website/53/2620353.jpg,"2019 제47회 대한민국 관광사진 공모전, 입선, 용아장성의 아침, 강원도 인제군, 설악산국립공원, 산등성이, 능선, 자연",강원도 인제군,강원도 인제군
2620361,제주특별자치도 제주시 애월읍 무수,http://tong.visitkorea.or.kr/cms2/website/61/2620361.jpg,"2019 제47회 대한민국 관광사진 공모전, 입선, 자연이 만든 조각품, 제주특별자치도 제주시 애월읍, 제주도, 무수천, 올레길 17코스, 기암절벽, 바위",제주특별자치도 제주시,제주특별자치도 제주시 애월읍
2620366,산방산을 바라보며,http://tong.visitkorea.or.kr/cms2/website/66/2620366.jpg,"2019 제47회 대한민국 관광사진 공모전, 입선, 산방산을 바라보며, 제주특별자치도 서귀포시, 제주도, 화산섬",제주특별자치도 서귀포시,제주특별자치도 서귀포시 안덕면
2620370,불꽃축제,http://tong.visitkorea.or.kr/cms2/website/70/2620370.jpg,"2019 제47회 대한민국 관광사진 공모전, 불꽃축제, 서울특별시 송파구, 롯데월드타워 불꽃축제, 불꽃놀이, 제2롯데월드, 마천루, 롯데월드타워 야경",서울특별시 송파구,서울특별시 송파구 신천동
2620235,마지막 벚꽃,http://tong.visitkorea.or.kr/cms2/website/35/2620235.jpg,"2019 제47회 대한민국 관광사진 공모전, 동상, 마지막 벚꽃, 전라북도 진안군, 마이산 도립공원, 명승 제12호, 봄, 드론촬영, 드론사진, 항공촬영",전라북도 진안군,전라북도 진안군 진안읍
