galContentId,galTitle,galWebImageUrl,galSearchKeyword,processedLocation,galPhotographyLocation
3332952,재인폭포,http://tong.visitkorea.or.kr/cms2/website/52/3332952.jpg,"재인폭포, 경기도 연천군, 한탄강 유네스코 세계지질공원, 한탄강지질공원, 국가지질공원, 자연유산, 명승, 나무, 숲, 산, 구름, 사진기자단, 프레임코리아2기",경기도 연천군,경기도 연천군 연천읍
3332720,임진강,http://tong.visitkorea.or.kr/cms2/website/20/3332720.jpg,"임진강, 경기도 연천군, 하천, 일몰, 석양, 빛내림, 틴들 현상",경기도 연천군,경기도 연천군
3332708,마장호수 출렁다리,http://tong.visitkorea.or.kr/cms2/website/08/3332708.jpg,"마장호수 출렁다리, 경기도 파주시, 마장호수 흔들다리, 대교, 교량, 산책로, 산책길, 숲, 산, 사진기자단, 프레임코리아2기",경기도 파주시,경기도 파주시 광탄면
3318119,한국관광공사,http://tong.visitkorea.or.kr/cms2/website/19/3318119.jpg,"한국관광공사, 강원특별자치도 원주시, 혁신도시, 사옥, 빌딩, 건물, 전경, 겨울, 드론촬영, 드론사진, 항공촬영",강원특별자치도 원주시,강원특별자치도 원주시 반곡동
3318101,봉명산 출렁다리,http://tong.visitkorea.or.kr/cms2/website/01/3318101.jpg,"봉명산 출렁다리, 경상북도 문경시, 보행현수교, 걷기여행, 드론촬영, 드론사진, 항공촬영, 파노라마",경상북도 문경시,경상북도 문경시 문경읍
3317767,문경새재도립공원,http://tong.visitkorea.or.kr/cms2/website/67/3317767.jpg,"문경새재도립공원, 경상북도 문경시, 문화유산, 사적 제147호, 문경 조령 관문, 산책로, 산책길, 걷기여행, 드론촬영, 드론사진, 항공촬영, 파노라마",경상북도 문경시,경상북도 문경시 문경읍
3313908,하동송림공원,http://tong.visitkorea.or.kr/cms2/website/08/3313908.jpg,"하동송림공원, 경상남도 하동군, 자연유산, 천연기념물 제445호, 소나무 숲, 솔숲, 산책로, 산책길, 걷기여행",경상남도 하동군,경상남도 하동군 하동읍
3312643,화개동천 야생차밭,http://tong.visitkorea.or.kr/cms2/website/43/3312643.jpg,"화개동천 야생차밭, 경상남도 하동군, 녹차시배지, 차나무시배지, 녹차밭, 드론촬영, 드론사진, 항공촬영, 파노라마",경상남도 하동군,경상남도 하동군 화개면
3312005,하동 쌍계사,http://tong.visitkorea.or.kr/cms2/website/05/3312005.jpg,"하동 쌍계사, 경상남도 하동군, 절, 사찰, 종교, 불교, 지리산국립공원, 숲, 나무, 산책로, 산책길, 걷기여행",경상남도 하동군,경상남도 하동군 화개면
3311934,화개장터,http://tong.visitkorea.or.kr/cms2/website/34/3311934.jpg,"화개장터, 경상남도 하동군, 재래시장, 섬진강, 남도대교, 드론촬영, 드론사진, 항공촬영, 파노라마",경상남도 하동군,경상남도 하동군 화개면
3311904,장군목유원지,http://tong.visitkorea.or.kr/cms2/website/04/3311904.jpg,"장군목유원지, 전북특별자치도 순창군, 요강바위, 포트홀, 섬진강, 드론촬영, 드론사진, 항공촬영",전북특별자치도 순창군,전북특별자치도 순창군 동계면
3311785,용궐산 하늘길,http://tong.visitkorea.or.kr/cms2/website/85/3311785.jpg,"용궐산 하늘길, 전북특별자치도 순창군, 잔도, 산책로, 산책길, 트레킹, 걷기여행, 암벽, 기암괴석, 섬진강, 드론촬영, 드론사진, 항공촬영, 파노라마",전북특별자치도 순창군,전북특별자치도 순창군 동계면
3311570,강천산군립공원,http://tong.visitkorea.or.kr/cms2/website/70/3311570.jpg,"강천산군립공원, 전북특별자치도 순창군, 숲, 나무, 구장군폭포, 드론촬영, 드론사진, 항공촬영, 파노라마",전북특별자치도 순창군,전북특별자치도 순창군 팔덕면
3311363,물건항,http://tong.visitkorea.or.kr/cms2/website/63/3311363.jpg,"물건항, 경상남도 남해군, 항구, 바다, 남해 물건리 방조어부림, 숲, 자연유산, 천연기념물 제150호, 드론촬영, 드론사진, 항공촬영, 파노라마",경상남도 남해군,경상남도 남해군 삼동면
3311361,독일마을,http://tong.visitkorea.or.kr/cms2/website/61/3311361.jpg,"독일마을, 경상남도 남해군, 문화마을, 체험마을, 드론촬영, 드론사진, 항공촬영, 파노라마",경상남도 남해군,경상남도 남해군 삼동면
3311345,남해 물건리 방조어부림,http://tong.visitkorea.or.kr/cms2/website/45/3311345.jpg,"남해 물건리 방조어부림, 경상남도 남해군, 숲, 자연유산, 천연기념물 제150호, 산책로, 산책길, 걷기여행, 물건항, 바다, 드론촬영, 드론사진, 항공촬영, 파노라마",경상남도 남해군,경상남도 남해군 삼동면
3311319,남해군 요트학교,http://tong.visitkorea.or.kr/cms2/website/19/3311319.jpg,"남해군 요트학교, 경상남도 남해군, 레저시설, 교육장, 체험, 물건항, 바다, 드론촬영, 드론사진, 항공촬영, 파노라마",경상남도 남해군,경상남도 남해군 삼동면
3311294,구례 천은사,http://tong.visitkorea.or.kr/cms2/website/94/3311294.jpg,"구례 천은사, 전라남도 구례군, 절, 사찰, 종교, 불교, 지리산국립공원, 미스터 션샤인 촬영지, 드라마 촬영지, 사찰명상순례길, 연등",전라남도 구례군,전라남도 구례군 광의면
3311001,지리산호수공원오토캠핑장,http://tong.visitkorea.or.kr/cms2/website/01/3311001.jpg,"지리산호수공원오토캠핑장, 전라남도 구례군, 구만제, 구만저수지, 드론촬영, 드론사진, 항공촬영, 파노라마",전라남도 구례군,전라남도 구례군 산동면
3310934,지리산치즈랜드,http://tong.visitkorea.or.kr/cms2/website/34/3310934.jpg,"지리산치즈랜드, 전라남도 구례군, 체험목장, 관광농원, 구만제, 구만저수지, 출렁다리, 드론촬영, 드론사진, 항공촬영, 파노라마",전라남도 구례군,전라남도 구례군 산동면
3310894,구례 운흥정,http://tong.visitkorea.or.kr/cms2/website/94/3310894.jpg,"구례 운흥정, 전라남도 구례군, 정자, 정각, 용운교",전라남도 구례군,전라남도 구례군 산동면
3108474,치악산국립공원,http://tong.visitkorea.or.kr/cms2/website/74/3108474.jpg,"치악산국립공원, 강원특별자치도 원주시, 눈, 설경, 겨울, 드론촬영, 드론사진, 항공촬영, 파노라마",강원특별자치도 원주시,강원특별자치도 원주시 소초면
3108458,거돈사지,http://tong.visitkorea.or.kr/cms2/website/58/3108458.JPG,"거돈사지, 강원특별자치도 원주시, 사적 제168호, 절터, 사찰터, 눈, 설경, 겨울, 드론촬영, 드론사진, 항공촬영",강원특별자치도 원주시,강원특별자치도 원주시 부론면
3108341,원주 반계리 은행나무,http://tong.visitkorea.or.kr/cms2/website/41/3108341.jpg,"원주 반계리 은행나무, 강원특별자치도 원주시, 천연기념물 제167호, 은행잎, 보호수, 고목, 눈, 설경, 겨울, 드론촬영, 드론사진, 항공촬영, 파노라마",강원특별자치도 원주시,강원특별자치도 원주시 문막읍
3097712,밀양 금시당 백곡재,http://tong.visitkorea.or.kr/cms2/website/12/3097712.jpg,"밀양 금시당 백곡재, 경상남도 밀양시, 별서, 은행나무, 은행잎, 단풍, 가을, 추경, 11월 버킷, 11월 추천여행지, 사진기자단, 프레임코리아1기",경상남도 밀양시,경상남도 밀양시 활성동
3099274,파로호 전망대,http://tong.visitkorea.or.kr/cms2/website/74/3099274.jpg,"파로호 전망대, 강원특별자치도 화천군, 강원도, 11월 버킷, 11월 추천여행지, 사진기자단, 프레임코리아1기",강원특별자치도 화천군,강원특별자치도 화천군 간동면
3099317,파로호,http://tong.visitkorea.or.kr/cms2/website/17/3099317.jpg,"파로호, 강원특별자치도 화천군, 강원도, 인공호수, 대붕호, 11월 버킷, 11월 추천여행지, 사진기자단, 프레임코리아1기",강원특별자치도 화천군,강원특별자치도 화천군 간동면
3097570,수옥폭포,http://tong.visitkorea.or.kr/cms2/website/70/3097570.jpg,"수옥폭포, 충청북도 괴산군, 바위, 가을, 추경, 야경, 11월 버킷, 11월 추천여행지, 사진기자단, 프레임코리아1기",충청북도 괴산군,충청북도 괴산군 연풍면
3098477,월악산국립공원,http://tong.visitkorea.or.kr/cms2/website/77/3098477.jpg,"월악산국립공원, 충청북도 제천시, 자연, 산등성이, 능선, 충주호, 11월 버킷, 11월 추천여행지, 사진기자단, 프레임코리아1기",충청북도 제천시,충청북도 제천시 한수면
3099826,서울 어린이대공원,http://tong.visitkorea.or.kr/cms2/website/26/3099826.JPG,"서울 어린이대공원, 서울특별시 광진구, 테마파크, 가족테마공원, 알파카, 동물, 11월 추천여행지, 사진기자단, 프레임코리아1기",서울특별시 광진구,서울특별시 광진구 능동
3097836,춘천 삼악산 호수케이블카,http://tong.visitkorea.or.kr/cms2/website/36/3097836.JPG,"춘천 삼악산 호수케이블카, 강원특별자치도 춘천시, 강원도, 단풍, 가을, 추경, 11월 버킷, 11월 추천여행지, 사진기자단, 프레임코리아1기",강원특별자치도 춘천시,강원특별자치도 춘천시 삼천동
3098315,용눈이오름,http://tong.visitkorea.or.kr/cms2/website/15/3098315.JPG,"용눈이오름, 제주특별자치도 제주시, 제주도, 분화구, 제주오름, 억새밭, 가을, 추경, 풍력발전기, 11월 추천여행지, 사진기자단, 프레임코리아1기",제주특별자치도 제주시,제주특별자치도 제주시 구좌읍
3098163,제이드가든,http://tong.visitkorea.or.kr/cms2/website/63/3098163.JPG,"제이드가든, 강원특별자치도 춘천시, 강원도, 수목원, 유럽식정원, 테마파크, 산책로, 산책길, 걷기여행, 11월 버킷, 11월 추천여행지, 사진기자단, 프레임코리아1기",강원특별자치도 춘천시,강원특별자치도 춘천시 남산면
3099709,송파나루공원,http://tong.visitkorea.or.kr/cms2/website/09/3099709.jpg,"송파나루공원, 서울특별시 송파구, 석촌호수공원, 가을, 추경, 11월 추천여행지, 사진기자단, 프레임코리아1기",서울특별시 송파구,서울특별시 송파구 잠실동
3097542,괴산 괴강불빛공원,http://tong.visitkorea.or.kr/cms2/website/42/3097542.jpg,"괴산 괴강불빛공원, 충청북도 괴산군, 테마공원, 산책로, 산책길, 걷기여행, 야경, 11월 버킷, 11월 추천여행지, 사진기자단, 프레임코리아1기",충청북도 괴산군,충청북도 괴산군 괴산읍
3100348,당포성지 및 당포대첩지,http://tong.visitkorea.or.kr/cms2/website/48/3100348.jpg,"당포성지 및 당포대첩지, 경상남도 통영시, 성터, 성곽, 바다, 드론촬영, 드론사진, 항공촬영, 11월 버킷, 11월 추천여행지, 사진기자단, 프레임코리아1기",경상남도 통영시,경상남도 통영시 산양읍
3099395,창경궁,http://tong.visitkorea.or.kr/cms2/website/95/3099395.jpg,"창경궁, 서울특별시 종로구, 사적 제123호, 고궁, 궁궐, 창경궁 대온실, 국가등록문화재 제83호, 11월 버킷, 11월 추천여행지, 사진기자단, 프레임코리아1기",서울특별시 종로구,서울특별시 종로구 와룡동
3098349,봉은사,http://tong.visitkorea.or.kr/cms2/website/49/3098349.jpg,"봉은사, 서울특별시 강남구, 절, 사찰, 종교, 불교, 미륵대불, 부처상, 불상, 야경, 11월 추천여행지, 사진기자단, 프레임코리아1기",서울특별시 강남구,서울특별시 강남구 삼성동
3100383,통영대교,http://tong.visitkorea.or.kr/cms2/website/83/3100383.jpg,"통영대교, 경상남도 통영시, 교량, 다리, 전경, 드론촬영, 드론사진, 항공촬영, 11월 버킷, 11월 추천여행지, 사진기자단, 프레임코리아1기",경상남도 통영시,경상남도 통영시 미수동
3097292,남이섬,http://tong.visitkorea.or.kr/cms2/website/92/3097292.jpg,"남이섬, 강원특별자치도 춘천시, 강원도, 나미나라 공화국, 단풍, 가을, 추경, 은행나무, 은행잎, 11월 추천여행지, 사진기자단, 프레임코리아1기",강원특별자치도 춘천시,강원특별자치도 춘천시 남산면
3102110,함양 운곡리 은행나무,http://tong.visitkorea.or.kr/cms2/website/10/3102110.jpg,"함양 운곡리 은행나무, 경상남도 함양군, 천연기념물 제406호, 은행잎, 단풍, 가을, 추경, 드론촬영, 드론사진, 항공촬영, 11월 추천여행지, 사진기자단, 프레임코리아1기",경상남도 함양군,경상남도 함양군 서하면
3097098,백범광장,http://tong.visitkorea.or.kr/cms2/website/98/3097098.jpg,"백범광장, 서울특별시 중구, 독립운동가, 일제강점기, 공원, 호현당, 11월 추천여행지, 사진기자단, 프레임코리아1기",서울특별시 중구,서울특별시 중구
3100468,통영 서포루,http://tong.visitkorea.or.kr/cms2/website/68/3100468.jpg,"통영 서포루, 경상남도 통영시, 서장대, 성곽, 전경, 드론촬영, 드론사진, 항공촬영, 11월 버킷, 11월 추천여행지, 사진기자단, 프레임코리아1기",경상남도 통영시,경상남도 통영시 중앙동
3097272,부산불꽃축제,http://tong.visitkorea.or.kr/cms2/website/72/3097272.jpg,"부산불꽃축제, 부산광역시 수영구, 광안리해수욕장, 광안대교, 불꽃놀이, 야경, 11월 추천여행지, 사진기자단, 프레임코리아1기",부산광역시 수영구,부산광역시 수영구 광안동
3097458,김해 연지공원,http://tong.visitkorea.or.kr/cms2/website/58/3097458.jpg,"김해 연지공원, 경상남도 김해시, 수변공원, 도심공원, 호수, 가을, 추경, 산책로, 산책길, 걷기여행, 11월 추천여행지, 사진기자단, 프레임코리아1기",경상남도 김해시,경상남도 김해시 내동
3098655,월화원,http://tong.visitkorea.or.kr/cms2/website/55/3098655.jpg,"월화원, 경기도 수원시, 효원공원, 중국식 정원, 전통공원, 테마공원, , 단풍, 가을, 추경, 11월 추천여행지, 사진기자단, 프레임코리아1기",경기도 수원시,경기도 수원시 팔달구
3097677,주왕산국립공원,http://tong.visitkorea.or.kr/cms2/website/77/3097677.jpg,"주왕산국립공원, 경상북도 청송군, 바위, 산책로, 산책길, 트래킹, 트레킹, 걷기여행, 11월 추천여행지, 사진기자단, 프레임코리아1기",경상북도 청송군,경상북도 청송군 주왕산면
3100362,통영 삼도수군통제영,http://tong.visitkorea.or.kr/cms2/website/62/3100362.jpg,"통영 삼도수군통제영, 경상남도 통영시, 사적 제402호, 전경, 드론촬영, 드론사진, 항공촬영, 11월 버킷, 11월 추천여행지, 사진기자단, 프레임코리아1기",경상남도 통영시,경상남도 통영시 문화동
3097084,서울 한양도성길,http://tong.visitkorea.or.kr/cms2/website/84/3097084.jpg,"서울 한양도성길, 서울특별시 용산구, 서울성곽길, 한양도성길 3코스, 남산구간, 남산성곽길, 산책로, 산책길, 걷기여행, 남산서울타워, 남산공원 N서울타워, 남산타워, 11월 추천여행지, 사진기자단, 프레임코리아1기",서울특별시 중구,서울특별시 중구
3100457,통영 동포루,http://tong.visitkorea.or.kr/cms2/website/57/3100457.jpg,"통영 동포루, 경상남도 통영시, 동장대, 성곽, 전경, 드론촬영, 드론사진, 항공촬영, 11월 버킷, 11월 추천여행지, 사진기자단, 프레임코리아1기",경상남도 통영시,경상남도 통영시 태평동
3100377,통영 충무교,http://tong.visitkorea.or.kr/cms2/website/77/3100377.jpg,"통영 충무교, 경상남도 통영시, 교량, 다리, 전경, 운하, 드론촬영, 드론사진, 항공촬영, 11월 버킷, 11월 추천여행지, 사진기자단, 프레임코리아1기",경상남도 통영시,경상남도 통영시 미수동
3097058,수봉공원,http://tong.visitkorea.or.kr/cms2/website/58/3097058.jpg,"수봉공원, 인천광역시 도시공원, 테마공원, 미추홀구, 수봉산, 가을, 추경, 현충탑, 11월 추천여행지, 사진기자단, 프레임코리아1기",인천광역시 미추홀구,인천광역시 미추홀구 숭의동
3100315,황매산,http://tong.visitkorea.or.kr/cms2/website/15/3100315.jpg,"황매산, 경상남도 합천군, 황매산 군립공원, 가을, 추경, 산책로, 산책길, 트레킹, 트래킹, 걷기여행, 등산, 11월 추천여행지, 사진기자단, 프레임코리아1기",경상남도 합천군,경상남도 합천군 가회면
3099123,곡운구곡,http://tong.visitkorea.or.kr/cms2/website/23/3099123.jpg,"곡운구곡, 강원특별자치도 화천군, 강원도, 계곡, 강원평화지역 국가지질공원, DMZ 관광, DMZ 투어, 곡운구곡 출렁다리, 은하수, 별, 야경, 11월 버킷, 11월 추천여행지, 사진기자단, 프레임코리아1기",강원특별자치도 화천군,강원특별자치도 화천군 사내면
3100286,전주향교,http://tong.visitkorea.or.kr/cms2/website/86/3100286.jpg,"전주향교, 전북특별자치도 전주시, 전라북도, 사적 제379호, 한옥, 가을, 추경, 단풍, 은행나무, 은행잎, 11월 버킷, 11월 추천여행지, 사진기자단, 프레임코리아1기",전북특별자치도 전주시,전북특별자치도 전주시 완산구
3098530,삼척 해상케이블카,http://tong.visitkorea.or.kr/cms2/website/30/3098530.jpg,"삼척 해상케이블카, 강원특별자치도 삼척시, 강원도, 동해바다, 등대, 11월 추천여행지, 사진기자단, 프레임코리아1기",강원특별자치도 삼척시,강원특별자치도 삼척시 근덕면
3099032,매월대폭포,http://tong.visitkorea.or.kr/cms2/website/32/3099032.jpg,"매월대폭포, 강원특별자치도 철원군, 강원도, 자연, 바위, 절벽, 복계산, 11월 버킷, 11월 추천여행지, 사진기자단, 프레임코리아1기",강원특별자치도 철원군,강원특별자치도 철원군 근남면
3098769,곡교천 은행나무길,http://tong.visitkorea.or.kr/cms2/website/69/3098769.jpg,"곡교천 은행나무길, 충청남도 아산시, 은행잎, 낙엽, 단풍, 가을, 추경, 산책로, 산책길, 걷기여행, 11월 버킷, 11월 추천여행지, 사진기자단, 프레임코리아1기",충청남도 아산시,충청남도 아산시 염치읍
3098520,삼척 미인폭포,http://tong.visitkorea.or.kr/cms2/website/20/3098520.jpg,"삼척 미인폭포, 강원특별자치도 삼척시, 강원도, 자연, 바위, 절벽, 11월 추천여행지, 사진기자단, 프레임코리아1기",강원특별자치도 삼척시,강원특별자치도 삼척시 도계읍
3099374,광교호수공원,http://tong.visitkorea.or.kr/cms2/website/74/3099374.jpg,"광교호수공원, 경기도 수원시, 테마공원, 산책로, 산책길, 걷기여행, 드론촬영, 드론사진, 항공촬영, 11월 추천여행지, 사진기자단, 프레임코리아1기",경기도 수원시,경기도 수원시 영통구
3098528,장호항,http://tong.visitkorea.or.kr/cms2/website/28/3098528.jpg,"장호항, 강원특별자치도 삼척시, 강원도, 동해바다, 바위, 11월 추천여행지, 사진기자단, 프레임코리아1기",강원특별자치도 삼척시,강원특별자치도 삼척시 근덕면
3098700,민둥산,http://tong.visitkorea.or.kr/cms2/website/00/3098700.jpg,"민둥산, 강원특별자치도 정선군, 강원도, 억새밭, 가을, 추경, 자연관광지, 산책로, 산책길, 트레킹, 트래킹, 걷기여행, 11월 추천여행지, 사진기자단, 프레임코리아1기",강원특별자치도 정선군,강원특별자치도 정선군 남면
3098785,서울 길상사,http://tong.visitkorea.or.kr/cms2/website/85/3098785.jpg,"서울 길상사, 서울특별시 성북구, 절, 사찰, 종교, 불교, 단풍, 가을, 추경, 범종, 11월 추천여행지, 사진기자단, 프레임코리아1기",서울특별시 성북구,서울특별시 성북구 성북동
3097119,용담호,http://tong.visitkorea.or.kr/cms2/website/19/3097119.jpg,"용담호, 전북특별자치도 진안군, 전라북도, 저수지, 단풍, 반영, 단풍, 가을, 추경, 사진기자단, 프레임코리아1기",전북특별자치도 진안군,전북특별자치도 진안군 용담면
3097434,양방산 전망대,http://tong.visitkorea.or.kr/cms2/website/34/3097434.jpg,"양방산 전망대, 충청북도 단양군, 양방산 활공장, 전경, 11월 버킷, 11월 추천여행지, 사진기자단, 프레임코리아1기",충청북도 단양군,충청북도 단양군 단양면
3099348,화천시장,http://tong.visitkorea.or.kr/cms2/website/48/3099348.jpg,"화천시장, 강원특별자치도 화천군, 강원도, 전통시장, 11월 버킷, 11월 추천여행지, 사진기자단, 프레임코리아1기",강원특별자치도 화천군,강원특별자치도 화천군 화천읍
3097497,서울대학교,http://tong.visitkorea.or.kr/cms2/website/97/3097497.jpg,"서울대학교, 서울특별시 관악구, 11월 추천여행지, 사진기자단, 프레임코리아1기",서울특별시 관악구,서울특별시 관악구 신림동
3097260,경기전,http://tong.visitkorea.or.kr/cms2/website/60/3097260.jpg,"경기전, 전북특별자치도 전주시, 전라북도, 사적 제339호, 전주한옥마을, 전주 조경묘 정묘, 보물 제2190호, 기와, 은행나무, 은행잎, 낙엽, 단풍, 가을, 추경, 11월 추천여행지, 사진기자단, 프레임코리아1기",전북특별자치도 전주시,전북특별자치도 전주시 완산구
3097423,만천하스카이워크,http://tong.visitkorea.or.kr/cms2/website/23/3097423.jpg,"만천하스카이워크, 충청북도 단양군, 단양 전망대, 전경, 11월 버킷, 11월 추천여행지, 사진기자단, 프레임코리아1기",충청북도 단양군,충청북도 단양군 적성면
3100460,통영 북포루,http://tong.visitkorea.or.kr/cms2/website/60/3100460.jpg,"통영 북포루, 경상남도 통영시, 북장대, 성곽, 드론촬영, 드론사진, 항공촬영, 11월 버킷, 11월 추천여행지, 사진기자단, 프레임코리아1기",경상남도 통영시,경상남도 통영시 문화동
3097252,신성리 갈대밭,http://tong.visitkorea.or.kr/cms2/website/52/3097252.jpg,"신성리 갈대밭, 충청남도 서천군, 산책로, 산책길, 걷기여행, 공동경비구역 JSA 촬영지, 영화 촬영지, 11월 버킷, 11월 추천여행지, 사진기자단, 프레임코리아1기",충청남도 서천군,충청남도 서천군 한산면
3099799,수원탑동시민농장,http://tong.visitkorea.or.kr/cms2/website/99/3099799.JPG,"수원탑동시민농장, 경기도 수원시, 가을, 추경, 꽃밭, 댑싸리, 11월 버킷, 11월 추천여행지, 사진기자단, 프레임코리아1기",경기도 수원시,경기도 수원시 권선구
3102319,금산 요광리 은행나무,http://tong.visitkorea.or.kr/cms2/website/19/3102319.jpg,"금산 요광리 은행나무, 충청남도 금산군, 천연기념물 제84호, 은행잎, 단풍, 가을, 추경, 드론촬영, 드론사진, 항공촬영, 11월 추천여행지, 사진기자단, 프레임코리아1기",충청남도 금산군,충청남도 금산군 추부면
3099267,화천 파로호 안보전시관,http://tong.visitkorea.or.kr/cms2/website/67/3099267.jpg,"화천 파로호 안보전시관, 강원특별자치도 화천군, 강원도, 11월 버킷, 11월 추천여행지, 사진기자단, 프레임코리아1기",강원특별자치도 화천군,강원특별자치도 화천군 간동면
3099302,화천 자유수호희생자위령탑,http://tong.visitkorea.or.kr/cms2/website/02/3099302.jpg,"화천 자유수호희생자위령탑, 강원특별자치도 화천군, 강원도, 11월 버킷, 11월 추천여행지, 사진기자단, 프레임코리아1기",강원특별자치도 화천군,강원특별자치도 화천군 간동면
3099227,거례리수목공원,http://tong.visitkorea.or.kr/cms2/website/27/3099227.jpg,"거례리수목공원, 강원특별자치도 화천군, 강원도, 아를테마 수목원, 아를테마 수목공원, 북한강, 11월 버킷, 11월 추천여행지, 사진기자단, 프레임코리아1기",강원특별자치도 화천군,강원특별자치도 화천군 하남면
3097771,월연정,http://tong.visitkorea.or.kr/cms2/website/71/3097771.jpg,"월연정, 경상남도 밀양시, 밀양8경, 한옥, 고택, 서까래, 11월 버킷, 11월 추천여행지, 사진기자단, 프레임코리아1기",경상남도 밀양시,경상남도 밀양시 용평동
3097609,청송 대전사,http://tong.visitkorea.or.kr/cms2/website/09/3097609.jpg,"청송 대전사, 경상북도 청송군, 절, 사찰, 종교, 불교, 주왕산국립공원, 대전사 보광전, 보물 제1507호, 야경, 11월 추천여행지, 사진기자단, 프레임코리아1기",경상북도 청송군,경상북도 청송군 주왕산면
3098289,제주 레일바이크,http://tong.visitkorea.or.kr/cms2/website/89/3098289.JPG,"제주 레일바이크, 제주특별자치도 제주시, 제주도, 제주레일파크, 억새밭, 가을, 추경, 11월 추천여행지, 사진기자단, 프레임코리아1기",제주특별자치도 제주시,제주특별자치도 제주시 구좌읍
3097750,오연정,http://tong.visitkorea.or.kr/cms2/website/50/3097750.jpg,"오연정, 경상남도 밀양시, 은행나무, 은행잎, 단풍, 가을, 추경, 기와, 서까래, 돌담, 11월 버킷, 11월 추천여행지, 사진기자단, 프레임코리아1기",경상남도 밀양시,경상남도 밀양시 교동
