galContentId,galTitle,galWebImageUrl,galSearchKeyword,processedLocation,galPhotographyLocation
2504299,한라산 정상,http://tong.visitkorea.or.kr/cms2/website/99/2504299.jpg,"2017 제45회 대한민국 관광사진 공모전, 입선, 새해아침, 제주특별자치도 서귀포시, 제주도, 한라산 정상, 유네스코 세계자연유산, 유네스코 세계유산, 화산섬, 구름, 운해",제주특별자치도 서귀포시,제주특별자치도 서귀포시
2504300,한라산의봄,http://tong.visitkorea.or.kr/cms2/website/00/2504300.jpg,"2017 제45회 대한민국 관광사진 공모전, 입선, 한라산의봄, 제주특별자치도 서귀포시, 유네스코 세계자연유산, 유네스코 세계유산, 화산섬, 철쭉, 꽃",제주특별자치도 서귀포시,제주특별자치도 서귀포시
2504302,제주 바다,http://tong.visitkorea.or.kr/cms2/website/02/2504302.jpg,"2017 제45회 대한민국 관광사진 공모전, 입선, 제주 바다, 제주특별자치도 제주시, 싱계물공원, 신창 풍차해안, 제주도 전경, 풍력발전기, 구름",제주특별자치도 제주시,제주특별자치도 제주시 한경면
2504303,황매산 은하수,http://tong.visitkorea.or.kr/cms2/website/03/2504303.jpg,"2017 제45회 대한민국 관광사진 공모전, 입선, 황매산 은하수, 경상남도 산청군, 밤하늘, 별, 은하수, 야경",경상남도 산청군,경상남도 산청군 차황면
2504305,황우지해변,http://tong.visitkorea.or.kr/cms2/website/05/2504305.jpg,"2017 제45회 대한민국 관광사진 공모전, 입선, 여유, 제주특별자치도 서귀포시, 제주도, 황우지해안, 황우지해변, 선녀탕, 바다, 기암, 수영, 여름",제주특별자치도 서귀포시,제주특별자치도 서귀포시
2504333,월드타워와 석촌호수(가을),http://tong.visitkorea.or.kr/cms2/website/33/2504333.jpg,"2017 제45회 대한민국 관광사진 공모전, 입선, 월드타워와 석촌호수(가을), 서울특별시 송파구, 롯데월드타워, 제2롯데월드, 마천루",서울특별시 송파구,서울특별시 송파구 신천동
2504335,포항불빛축제,http://tong.visitkorea.or.kr/cms2/website/35/2504335.jpg,"2017 제45회 대한민국 관광사진 공모전, 입선, 포항불빛축제, 경상북도 포항시, 포항국제불빛축제, 영일대 해수욕장, 영일만, 불꽃축제, 포항야경",경상북도 포항시,경상북도 포항시 북구
2504338,성산봉의 여명,http://tong.visitkorea.or.kr/cms2/website/38/2504338.jpg,"2017 제45회 대한민국 관광사진 공모전, 입선, 성산봉의 여명, 제주특별자치도 서귀포시, 제주도, 성산일출봉, 유네스코 세계자연유산, 유네스코 세계유산, 천연기념물 제420호, 화산섬, 문주란, 천연기념물 제19호, 광치기해변",제주특별자치도 서귀포시,제주특별자치도 서귀포시 성산읍
2504219,백학봉의 빛,http://tong.visitkorea.or.kr/cms2/website/19/2504219.jpg,"2017 제45회 대한민국 관광사진 공모전, 입선, 백학봉의 빛, 전라남도 장성군, 내장산국립공원, 백암산, 백양사, 쌍계루, 반영, 겨울, 설경, 눈",전라남도 장성군,전라남도 장성군 북하면
2504220,즐거운날,http://tong.visitkorea.or.kr/cms2/website/20/2504220.jpg,"2017 제45회 대한민국 관광사진 공모전, 입선, 즐거운날, 전라북도 전주시, 전주한옥마을, 전통마을, 슬로시티, 청사초롱, 겨울, 눈",전라북도 전주시,전라북도 전주시 완산구
2504223,축제의 밤,http://tong.visitkorea.or.kr/cms2/website/23/2504223.jpg,"2017 제45회 대한민국 관광사진 공모전, 입선, 축제의 밤, 경상북도 포항시, 영일대 해수욕장, 포항국제불빛축제, 불꽃축제, 포항야경",경상북도 포항시,경상북도 포항시 북구
2504224,보성다원의 빛,http://tong.visitkorea.or.kr/cms2/website/24/2504224.jpg,"2017 제45회 대한민국 관광사진 공모전, 입선, 보성다원의 빛, 전라남도 보성군, 대한다원, 대한1다원, 대한다원 1농장, 보성녹차밭, 대한다업",전라남도 보성군,전라남도 보성군 보성읍
2504226,구름이 머물다간 월류봉,http://tong.visitkorea.or.kr/cms2/website/26/2504226.jpg,"2017 제45회 대한민국 관광사진 공모전, 입선, 구름이 머물다간 월류봉, 충청북도 영동군, 한천팔경, 정자, 운무",충청북도 영동군,충청북도 영동군 황간면
2504230,낙안읍성의 아침,http://tong.visitkorea.or.kr/cms2/website/30/2504230.jpg,"2017 제45회 대한민국 관광사진 공모전, 입선, 낙안읍성의 아침, 전라남도 순천시, 낙안읍성 민속마을, 사적 제302호, 낙안민속마을, 전통마을, 초가집, 운무",전라남도 순천시,전라남도 순천시 낙안면
2504234,봉은사 야경,http://tong.visitkorea.or.kr/cms2/website/34/2504234.jpg,"2017 제45회 대한민국 관광사진 공모전, 입선, 봉은사 야경, 서울특별시 강남구, 절, 사찰, 미륵대불, 부처상, 불상, 서울야경",서울특별시 강남구,서울특별시 강남구 삼성동
2504235,우주 정거장,http://tong.visitkorea.or.kr/cms2/website/35/2504235.jpg,"2017 제45회 대한민국 관광사진 공모전, 입선, 우주 정거장, 경상북도 상주시, 경천섬공원, 경천섬 야경, 상주시 야경",경상북도 상주시,경상북도 상주시 중동면
2504238,보성 차밭,http://tong.visitkorea.or.kr/cms2/website/38/2504238.jpg,"2017 제45회 대한민국 관광사진 공모전, 입선, 神仙의 茶園, 전라남도 보성군, 대한다원, 대한1다원, 대한다원 1농장, 보성녹차밭, 대한다업, 운무",전라남도 보성군,전라남도 보성군 보성읍
2504239,웅도의 바닷길,http://tong.visitkorea.or.kr/cms2/website/39/2504239.jpg,"2017 제45회 대한민국 관광사진 공모전, 입선, 웅도의 바닷길, 충청남도 서산시, 웅도 바다갈라짐, 웅도 유두교, 웅도 야경, 다리, 밀물",충청남도 서산시,충청남도 서산시 대산읍
2504240,산사의 겨울풍경,http://tong.visitkorea.or.kr/cms2/website/40/2504240.jpg,"2017 제45회 대한민국 관광사진 공모전, 입선, 산사의 겨울풍경, 전라북도 고창군, 선운사, 절, 사찰, 감나무, 겨울, 설경, 눈",전라북도 고창군,전라북도 고창군 아산면
2504241,월영교의 아침 물안개,http://tong.visitkorea.or.kr/cms2/website/41/2504241.jpg,"2017 제45회 대한민국 관광사진 공모전, 입선, 월영교의 아침 물안개, 경상북도 안동시, 나무다리, 목교, 월영정, 정자, 안동호",경상북도 안동시,경상북도 안동시
2504243,정북동 토성의 추억,http://tong.visitkorea.or.kr/cms2/website/43/2504243.jpg,"2017 제45회 대한민국 관광사진 공모전, 입선, 정북동 토성의 추억, 충청북도 청주시, 사적 제415호, 성지, 나무",충청북도 청주시,충청북도 청주시
2504245,전주 한옥마을,http://tong.visitkorea.or.kr/cms2/website/45/2504245.jpg,"2017 제45회 대한민국 관광사진 공모전, 입선, 전주 한옥마을, 전라북도 전주시, 전주한옥마을 전경, 전통마을, 전통가옥, 슬로시티, 겨울, 설경, 눈",전라북도 전주시,전라북도 전주시 완산구
2504249,설국으로 가는길,http://tong.visitkorea.or.kr/cms2/website/49/2504249.jpg,"2017 제45회 대한민국 관광사진 공모전, 입선, 설국으로 가는길, 강원도 고성군, 설악산 국립공원, 설악산 전경, 겨울, 설경, 눈",강원도 고성군,강원도 고성군
2504250,명재고택의 장독대,http://tong.visitkorea.or.kr/cms2/website/50/2504250.jpg,"2017 제45회 대한민국 관광사진 공모전, 입선, 명재고택의 장독대, 충청남도 논산시, 중요민속자료 제190호, 윤증 선생, 전통가옥, 한옥숙박, 한옥체험관광, 항아리",충청남도 논산시,충청남도 논산시 강경읍
2504255,오대산 설국속 상원사,http://tong.visitkorea.or.kr/cms2/website/55/2504255.jpg,"2017 제45회 대한민국 관광사진 공모전, 입선, 오대산 설국속 상원사, 강원도 평창군, 절, 사찰, 오대산 국립공원, 겨울, 설경, 눈",강원도 평창군,강원도 평창군 진부면
2504256,눈덮인 묵호항 고요한 일출,http://tong.visitkorea.or.kr/cms2/website/56/2504256.jpg,"2017 제45회 대한민국 관광사진 공모전, 입선, 눈덮인 묵호항 고요한 일출, 강원도 동해시, 항구, 동해전경, 일출, 일몰, 겨울, 설경, 눈",강원도 동해시,강원도 동해시
2504257,안개낀 아침,http://tong.visitkorea.or.kr/cms2/website/57/2504257.jpg,"2017 제45회 대한민국 관광사진 공모전, 입선, 안개낀 아침, 충청북도 보은군, 솔밭공원, 솔숲, 송림, 소나무",충청북도 보은군,충청북도 보은군 탄부면
2504259,행복한 가족관광,http://tong.visitkorea.or.kr/cms2/website/59/2504259.jpg,"2017 제45회 대한민국 관광사진 공모전, 입선, 행복한 가족관광, 전라남도 광양시, 매화마을, 섬진마을, 매화나무, 매실나무",전라남도 광양시,전라남도 광양시 다압면
2504260,매화마을,http://tong.visitkorea.or.kr/cms2/website/60/2504260.jpg,"2017 제45회 대한민국 관광사진 공모전, 입선, 봄, 전라남도 광양시, 매화마을, 섬진마을, 매화나무, 매실나무, 초가집, 돌담",전라남도 광양시,전라남도 광양시 다압면
2504272,명량대첩축제,http://tong.visitkorea.or.kr/cms2/website/72/2504272.jpg,"2017 제45회 대한민국 관광사진 공모전, 입선, 명량해전 재현, 전라남도 진도군, 명량대첩축제, 진도대교, 녹진관광지, 녹진국민관광지, 녹진국민관광단지",전라남도 진도군,전라남도 진도군 군내면
2504276,고스락의 겨울,http://tong.visitkorea.or.kr/cms2/website/76/2504276.jpg,"2017 제45회 대한민국 관광사진 공모전, 입선, 고스락의 겨울, 전라북도 익산시, 항아리 공원, 장독대, 겨울, 설경, 눈",전라북도 익산시,전라북도 익산시 함열읍
2504309,월정사의 겨울,http://tong.visitkorea.or.kr/cms2/website/09/2504309.jpg,"2017 제45회 대한민국 관광사진 공모전, 입선, 월정사의 겨울, 강원도 평창군, 사찰, 절, 월정사 전경, 겨울, 설경, 눈",강원도 평창군,강원도 평창군 진부면
2504278,표충사의 만남,http://tong.visitkorea.or.kr/cms2/website/78/2504278.jpg,"2017 제45회 대한민국 관광사진 공모전, 입선, 표충사의 만남, 경상북도 밀양시, 절, 사찰, 배롱나무, 재약산",경상남도 밀양시,경상남도 밀양시 단장면
2504281,칠월의 인사..,http://tong.visitkorea.or.kr/cms2/website/81/2504281.jpg,"2017 제45회 대한민국 관광사진 공모전, 입선, 칠월의 인사.., 전라북도 김제시, 벽골제, 저수지, 쌍룡, 벽골제 야경",전라북도 김제시,전라북도 김제시 부량면
2504283,아름다운한국의설경,http://tong.visitkorea.or.kr/cms2/website/83/2504283.jpg,"2017 제45회 대한민국 관광사진 공모전, 입선, 아름다운한국의설경, 전라북도 무주군, 덕유산 국립공원, 운무, 운해, 겨울, 설경, 눈",전라북도 무주군,전라북도 무주군 설천면
2504285,새별오름에서 보는 제주의 석양,http://tong.visitkorea.or.kr/cms2/website/85/2504285.jpg,"2017 제45회 대한민국 관광사진 공모전, 입선, 새별오름에서 보는 제주의 석양, 제주특별자치도 제주시, 제주도, 제주오름, 일출, 일몰",제주특별자치도 제주시,제주특별자치도 제주시 애월읍
2504286,뱀가마속에서 익어가는 장인의 혼,http://tong.visitkorea.or.kr/cms2/website/86/2504286.jpg,"2017 제45회 대한민국 관광사진 공모전, 입선, 뱀가마속에서 익어가는 장인의 혼, 울산광역시 울주군, 도자기 가마",울산광역시 울주군,울산광역시 울주군 청량면
2504288,관람지의 가을,http://tong.visitkorea.or.kr/cms2/website/88/2504288.jpg,"2017 제45회 대한민국 관광사진 공모전, 입선, 관람지의 가을, 서울특별시 종로구, 창덕궁, 사적 제122호, 유네스코 세계문화유산, 유네스코 세계유산, 고궁, 궁궐, 연못, 관람정, 누정, 누각, 정자",서울특별시 종로구,서울특별시 종로구 와룡동
2504289,상서러운 아침풍경,http://tong.visitkorea.or.kr/cms2/website/89/2504289.jpg,"2017 제45회 대한민국 관광사진 공모전, 입선, 상서러운 아침풍경, 전라남도 순천시, 낙안읍성 민속마을, 사적 제302호, 낙안민속마을, 전통마을, 초가집",전라남도 순천시,전라남도 순천시 낙안면
2504290,각원사 봄 풍경,http://tong.visitkorea.or.kr/cms2/website/90/2504290.jpg,"2017 제45회 대한민국 관광사진 공모전, 입선, 각원사 봄 풍경, 충청남도 천안시, 절, 사찰, 겹벚꽃, 벚나무, 청동 아미타불상",충청남도 천안시,충청남도 천안시 동남구
2504291,무논 여행,http://tong.visitkorea.or.kr/cms2/website/91/2504291.jpg,"2017 제45회 대한민국 관광사진 공모전, 입선, 무논 여행, 충청남도 보령시, 패러글라이딩, 페러글라이딩, 항공 스포츠, 레포츠",충청남도 보령시,충청남도 보령시
2504297,머드축제,http://tong.visitkorea.or.kr/cms2/website/97/2504297.jpg,"2017 제45회 대한민국 관광사진 공모전, 입선, 머드축제, 충청남도 보령시, 보령 머드축제, 대천해수욕장, 진흙",충청남도 보령시,충청남도 보령시 신흑동
2504311,만송정줄불놀이,http://tong.visitkorea.or.kr/cms2/website/11/2504311.jpg,"2017 제45회 대한민국 관광사진 공모전, 입선, 만송정줄불놀이, 경상북도 안동시, 안동하회마을, 선유 줄불놀이, 낙화놀이",경상북도 안동시,경상북도 안동시 풍천면
2504315,목장의 봄,http://tong.visitkorea.or.kr/cms2/website/15/2504315.jpg,"2017 제45회 대한민국 관광사진 공모전, 입선, 목장의 봄, 경기도 안성시, 팜랜드, 유채꽃",경기도 안성시,경기도 안성시
2504316,혼저옵서예,http://tong.visitkorea.or.kr/cms2/website/16/2504316.jpg,"2017 제45회 대한민국 관광사진 공모전, 입선, 혼저옵서예, 제주특별자치도 제주시, 제주도, 메이즈랜드, 미로공원, 테마공원",제주특별자치도 제주시,제주특별자치도 제주시 구좌읍
2504318,월영교,http://tong.visitkorea.or.kr/cms2/website/18/2504318.jpg,"2017 제45회 대한민국 관광사진 공모전, 입선, 구름 위를 거닐다, 경상북도 안동시, 월영교, 나무다리, 목교, 월영정, 정자, 안동호",경상북도 안동시,경상북도 안동시
2504320,덕수궁의 가을,http://tong.visitkorea.or.kr/cms2/website/20/2504320.jpg,"2017 제45회 대한민국 관광사진 공모전, 입선, 덕수궁의 가을, 서울특별시 중구, 사적 제124호, 고궁, 궁궐, 덕수궁 야경, 서울전경, 서울야경, 가을, 단풍",서울특별시 중구,서울특별시 중구 정동
2504298,소매물도,http://tong.visitkorea.or.kr/cms2/website/98/2504298.jpg,"2017 제45회 대한민국 관광사진 공모전, 입선, 보물의 섬, 경상남도 통영시, 소매물도, 바다, 기암절벽, 등대섬",경상남도 통영시,경상남도 통영시 한산면
2504322,블랙이글즈 에어쇼,http://tong.visitkorea.or.kr/cms2/website/22/2504322.jpg,"2017 제45회 대한민국 관광사진 공모전, 입선, 블랙이글즈 에어쇼, 경상남도 사천시, 사천항공우주엑스포, 사천비행장",경상남도 사천시,경상남도 사천시 사천읍
2504326,전주한옥마을,http://tong.visitkorea.or.kr/cms2/website/26/2504326.jpg,"2017 제45회 대한민국 관광사진 공모전, 입선, 눈내린 한옥마을, 전라북도 전주시, 전주한옥마을 전경, 전통마을, 전통가옥, 슬로시티, 겨울, 설경, 눈",전라북도 전주시,전라북도 전주시 완산구
2504327,솔섬의 은하수,http://tong.visitkorea.or.kr/cms2/website/27/2504327.jpg,"2017 제45회 대한민국 관광사진 공모전, 입선, 솔섬의 은하수, 전라북도 부안군, 밤하늘, 별, 야경",전라북도 부안군,전라북도 부안군 변산면
2504328,명재고택의 가을,http://tong.visitkorea.or.kr/cms2/website/28/2504328.jpg,"2017 제45회 대한민국 관광사진 공모전, 입선, 명재고택의 가을, 충청남도 논산시, 중요민속자료 제190호, 윤증 선생, 전통가옥, 한옥숙박, 한옥체험관광, 항아리, 장독대, 가을, 단풍",충청남도 논산시,충청남도 논산시 강경읍
2504330,성곽위의 도시,http://tong.visitkorea.or.kr/cms2/website/30/2504330.jpg,"2017 제45회 대한민국 관광사진 공모전, 입선, 성곽위의 도시, 서울특별시 종로구, 서울 한양도성길, 서울성곽길, 한양도성길 2코스, 낙산성곽길, 산책로, 낙산공원 야경, 서울전경, 서울야경",서울특별시 종로구,서울특별시 종로구
2504332,낙안읍성 민속마을,http://tong.visitkorea.or.kr/cms2/website/32/2504332.jpg,"2017 제45회 대한민국 관광사진 공모전, 입선, 전통의 아름다움, 전라남도 순천시, 낙안읍성 민속마을, 사적 제302호, 낙안민속마을, 전통마을, 초가집, 운무",전라남도 순천시,전라남도 순천시 낙안면
2504217,합정 메세나폴리스,http://tong.visitkorea.or.kr/cms2/website/17/2504217.jpg,"2017 제45회 대한민국 관광사진 공모전, 특별상, Umbrella mania, 서울특별시 마포구, 메세나폴리스, 우산",서울특별시 마포구,서울특별시 마포구 서교동
2504237,다원의 아침,http://tong.visitkorea.or.kr/cms2/website/37/2504237.jpg,"2017 제45회 대한민국 관광사진 공모전, 입선, 다원의 아침, 전라남도 보성군, 대한다원, 대한1다원, 대한다원 1농장, 보성녹차밭, 대한다업",전라남도 보성군,전라남도 보성군 보성읍
2504321,바닷길 열리는날,http://tong.visitkorea.or.kr/cms2/website/21/2504321.jpg,"2017 제45회 대한민국 관광사진 공모전, 입선, 바닷길 열리는날, 전라남도 진도군, 진도 신비의 바닷길, 바다, 갯벌",전라남도 진도군,전라남도 진도군 고군면
2504236,일일 레져타운,http://tong.visitkorea.or.kr/cms2/website/36/2504236.jpg,"2017 제45회 대한민국 관광사진 공모전, 입선, 배롱꽃 여인, 전라남도 순천시, 일일레져타운, 배롱나무, 구름다리, 오두막, 호수, 물안개",전라남도 순천시,전라남도 순천시 송광면
2504211,동림저수지,http://tong.visitkorea.or.kr/cms2/website/11/2504211.jpg,"2017 제45회 대한민국 관광사진 공모전, 금상, 가창오리 날다, 전라북도 고창군, 동림저수지, 가창오리 군무",전라북도 고창군,전라북도 고창군 성내면
2504216,전라남도 여수시 묘도동,http://tong.visitkorea.or.kr/cms2/website/16/2504216.jpg,"2017 제45회 대한민국 관광사진 공모전, 동상, 아침출근길, 전라남도 여수시, 묘도, 다랭이논",전라남도 여수시,전라남도 여수시 묘도동
2504222,자작나무 숲,http://tong.visitkorea.or.kr/cms2/website/22/2504222.jpg,"2017 제45회 대한민국 관광사진 공모전, 입선, 자작나무 숲, 강원도 인제군, 자작나무 숲길, 겨울, 설경, 눈",강원도 인제군,강원도 인제군 인제읍
2504227,미륵산,http://tong.visitkorea.or.kr/cms2/website/27/2504227.jpg,"2017 제45회 대한민국 관광사진 공모전, 입선, 구름 위의 세상, 경상남도 통영시, 미륵산, 일출, 일몰, 구름, 운무, 운해",경상남도 통영시,경상남도 통영시
2504244,대구 풍둥축제,http://tong.visitkorea.or.kr/cms2/website/44/2504244.jpg,"2017 제45회 대한민국 관광사진 공모전, 입선, 소원이 두둥실, 대구광역시 달서구, 두류공원, 풍등축제, 형형색색 달구벌 관등놀이, 풍등날리기",대구광역시 달서구,대구광역시 달서구
2504251,북한강 남한강,http://tong.visitkorea.or.kr/cms2/website/51/2504251.jpg,"2017 제45회 대한민국 관광사진 공모전, 입선, 고요한 아침, 경기도 양평군, 두물머리, 남한강, 북한강, 느티나무, 황포 돛배, 돛단배, 물안개",경기도 양평군,경기도 양평군 양서면
2504258,맥,http://tong.visitkorea.or.kr/cms2/website/58/2504258.jpg,"2017 제45회 대한민국 관광사진 공모전, 입선, 맥(脈), 전라북도 임실군, 필봉마을 굿 축제, 농악축제, 풍물굿, 풍물놀이",전라북도 임실군,전라북도 임실군 강진면
2504273,웅도 바다갈라짐,http://tong.visitkorea.or.kr/cms2/website/73/2504273.jpg,"2017 제45회 대한민국 관광사진 공모전, 입선, 그 섬으로 가는 길…, 충청남도 서산시, 웅도 바다갈라짐, 웅도 유두교, 다리, 밀물",충청남도 서산시,충청남도 서산시 대산읍
2504279,롯데월드 타워,http://tong.visitkorea.or.kr/cms2/website/79/2504279.jpg,"2017 제45회 대한민국 관광사진 공모전, 입선, 서울 서울 서울, 서울특별시, 롯데월드타워, 제2롯데월드, 마천루, 남산서울타워, 남산타워",경기도 광주시,경기도 광주시
2504284,필터에 담긴 수섬,http://tong.visitkorea.or.kr/cms2/website/84/2504284.jpg,"2017 제45회 대한민국 관광사진 공모전, 입선, 필터에 담긴 수섬, 경기도 화성시, 삘기꽃, 일출, 일몰",경기도 화성시,경기도 화성시
2504287,4월 이야기,http://tong.visitkorea.or.kr/cms2/website/87/2504287.jpg,"2017 제45회 대한민국 관광사진 공모전, 입선, 4월 이야기, 울산광역시 남구, 무거천 야경, 벚꽃축제, 벚나무",울산광역시 남구,울산광역시 남구 무거동
2504294,물안개 피던 날,http://tong.visitkorea.or.kr/cms2/website/94/2504294.jpg,"2017 제45회 대한민국 관광사진 공모전, 입선, 물안개 피던 날, 전라남도 화순군, 세량지, 저수지, 산벚꽃, 반영",전라남도 화순군,전라남도 화순군 화순읍
2504314,미생의 다리,http://tong.visitkorea.or.kr/cms2/website/14/2504314.jpg,"2017 제45회 대한민국 관광사진 공모전, 입선, 미생의 다리, 경기도 시흥시, 노을, 일출, 일몰",경기도 시흥시,경기도 시흥시 장곡동
2504324,하얀모자쓴 산방산,http://tong.visitkorea.or.kr/cms2/website/24/2504324.jpg,"2017 제45회 대한민국 관광사진 공모전, 입선, 하얀모자쓴 산방산, 제주특별자치도 서귀포시, 제주도, 화산섬, 구름, 운무",제주특별자치도 서귀포시,제주특별자치도 서귀포시
2504331,여름의 찬가,http://tong.visitkorea.or.kr/cms2/website/31/2504331.jpg,"2017 제45회 대한민국 관광사진 공모전, 입선, 여름의 찬가, 강원도 삼척시, 무건리 이끼폭포, 계곡, 옥자 촬영지, 영화 촬영지",강원도 삼척시,강원도 삼척시 도계읍
2488753,어진박물관,http://tong.visitkorea.or.kr/cms2/website/53/2488753.jpg,"어진박물관, 전라북도 전주시, 전주한옥마을, 경기전, 전시관, 유물, 슬로시티",전라북도 전주시,전라북도 전주시 완산구
2475506,한보탄광,http://tong.visitkorea.or.kr/cms2/website/06/2475506.jpg,"한보탄광, 강원도 태백시, 태양의 후예, 드라마촬영지, 드라마세트장, 짚차",강원도 태백시,강원도 태백시 통동
2475449,태백석탄박물관,http://tong.visitkorea.or.kr/cms2/website/49/2475449.jpg,"태백석탄박물관, 강원도 태백시, 전시실, 석탄산업, 체험갱도관",강원도 태백시,강원도 태백시 소도동
2475350,태백고생대자연사박물관,http://tong.visitkorea.or.kr/cms2/website/50/2475350.jpg,"태백고생대자연사박물관, 강원도 태백시, 전시실",강원도 태백시,강원도 태백시 동점동
2475234,철암탄광역사촌,http://tong.visitkorea.or.kr/cms2/website/34/2475234.jpg,"철암탄광역사촌, 강원도 태백시, 전시관, 석탄산업 역사",강원도 태백시,강원도 태백시 철암동
2475196,철암역,http://tong.visitkorea.or.kr/cms2/website/96/2475196.jpg,"철암역, 강원도 태백시, 기차역",강원도 태백시,강원도 태백시 철암동
2475184,태백 상장동 벽화마을,http://tong.visitkorea.or.kr/cms2/website/84/2475184.jpg,"상장동 벽화마을, 강원도 태백시, 공공미술, 문화마을",강원도 태백시,강원도 태백시 상장동
2474432,삼척시립박물관,http://tong.visitkorea.or.kr/cms2/website/32/2474432.jpg,"삼척시립박물관, 강원도 삼척시, 전시실, 유물",강원도 삼척시,강원도 삼척시 성남동
2474389,비치조각공원,http://tong.visitkorea.or.kr/cms2/website/89/2474389.jpg,"비치조각공원, 강원도 삼척시, 새천년해안도로",강원도 삼척시,강원도 삼척시 교동
2474314,강원종합박물관,http://tong.visitkorea.or.kr/cms2/website/14/2474314.jpg,"강원종합박물관, 강원도 삼척시, 유물",강원도 삼척시,강원도 삼척시 신기면
2473697,허난설헌 생가터,http://tong.visitkorea.or.kr/cms2/website/97/2473697.jpg,"허난설헌 생가터, 강원도 강릉시, 한옥, 전통가옥, 문화재, 동상, 허균 허난설헌 기념공원",강원도 강릉시,강원도 강릉시 초당동
2473619,허균 허난설헌 기념관,http://tong.visitkorea.or.kr/cms2/website/19/2473619.jpg,"허균 허난설헌 기념관, 강원도 강릉시, 허균 허난설헌 기념공원, 전시관",강원도 강릉시,강원도 강릉시 초당동
2473510,에디슨과학박물관,http://tong.visitkorea.or.kr/cms2/website/10/2473510.jpg,"에디슨과학박물관, 강원도 강릉시",강원도 강릉시,강원도 강릉시 저동
