galContentId,galTitle,galWebImageUrl,galSearchKeyword,processedLocation,galPhotographyLocation
2814040,비응항,http://tong.visitkorea.or.kr/cms2/website/40/2814040.jpg,"비응항, 전라북도 군산시, 항구, 어선",전라북도 군산시,전라북도 군산시 비응도동
2813982,군산 영화의 거리,http://tong.visitkorea.or.kr/cms2/website/82/2813982.jpg,"군산 영화의 거리, 전라북도 군산시, 군산 근대시간여행 코스",전라북도 군산시,전라북도 군산시
2812715,은파호수공원,http://tong.visitkorea.or.kr/cms2/website/15/2812715.jpg,"은파호수공원, 전라북도 군산시, 은파국민관광지, 전북 천리길, 산책로, 산책길, 걷기여행",전라북도 군산시,전라북도 군산시 나운동
2812304,비응 마파지길,http://tong.visitkorea.or.kr/cms2/website/04/2812304.jpg,"비응 마파지길, 전라북도 군산시, 해안 데크산책로, 해안 산책로, 산책길, 걷기여행",전라북도 군산시,전라북도 군산시 비응도동
2812244,군산 선유도,http://tong.visitkorea.or.kr/cms2/website/44/2812244.jpg,"군산 선유도, 전라북도 군산시, 고군산군도, 섬, 선유도해수욕장, 선유도해변",전라북도 군산시,전라북도 군산시 옥도면
2812034,군산항,http://tong.visitkorea.or.kr/cms2/website/34/2812034.jpg,"군산항, 전라북도 군산시, 항구, 군산 내항 뜬다리 부두(부잔교), 국가등록문화재 제719-1호, 군산 근대시간여행 코스",전라북도 군산시,전라북도 군산시 장미동
2811984,군산근대역사박물관,http://tong.visitkorea.or.kr/cms2/website/84/2811984.jpg,"군산근대역사박물관, 전라북도 군산시, 전시관, 군산 근대시간여행 코스",전라북도 군산시,전라북도 군산시 장미동
2811959,군산 해망굴,http://tong.visitkorea.or.kr/cms2/website/59/2811959.jpg,"군산 해망굴, 전라북도 군산시, 터널, 국가등록문화재 제184호, 군산 근대시간여행 코스",전라북도 군산시,전라북도 군산시 해망동
2811819,군산 동국사,http://tong.visitkorea.or.kr/cms2/website/19/2811819.jpg,"군산 동국사, 전라북도 군산시, 일본식 사찰, 절, 종교, 불교, 군산 동국사 대웅전, 국가등록문화재 제64호, 군산 근대시간여행 코스, 파노라마",전라북도 군산시,전라북도 군산시 금광동
2811814,군산 근대건축관,http://tong.visitkorea.or.kr/cms2/website/14/2811814.jpg,"군산 근대건축관, 전라북도 군산시, 구 조선은행 군산지점, 국가등록문화재 제374호, 전시관, 군산 근대시간여행 코스",전라북도 군산시,전라북도 군산시 장미동
3043141,천국의 계단,http://tong.visitkorea.or.kr/cms2/website/41/3043141.jpg,"2023 대한민국 관광공모전(사진), 천국의 계단, 전라북도 완주군, 대둔산도립공원, 삼선계단, 산등성이, 운무, 단풍, 가을, 추경, 자연",전라북도 완주군,전라북도 완주군 운주면
3042957,전주향교,http://tong.visitkorea.or.kr/cms2/website/57/3042957.jpg,"2023 대한민국 관광공모전(사진), 백년의 시간을 거닐다, 전라북도 전주시, 전주향교, 사적 제379호, 한옥, 단풍, 가을, 추경, 은행나무, 은행잎",전라북도 전주시,전라북도 전주시 완산구
2951560,대구 안일사,http://tong.visitkorea.or.kr/cms2/website/60/2951560.jpg,"대구 안일사, 대구광역시 남구, 절, 사찰, 종교, 불교, 가을, 추경, 단풍, 드론촬영, 드론사진, 항공촬영",대구광역시 남구,대구광역시 남구 대명동
2950423,팔공산도립공원,http://tong.visitkorea.or.kr/cms2/website/23/2950423.jpg,"팔공산도립공원, 경상북도 경산시, 팔공산 갓바위, 갓바위지구, 보물 제431호, 경산 팔공산 관봉 석조여래좌상, 불상, 부처상, 드론촬영, 드론사진, 항공촬영",경상북도 경산시,경상북도 경산시 와촌면
2950395,독도,http://tong.visitkorea.or.kr/cms2/website/95/2950395.jpg,"독도, 경상북도 울릉군, 천연기념물 제336호, 독도 천연보호구역, 화산섬, 우리땅, 드론촬영, 드론사진, 항공촬영",경상북도 울릉군,경상북도 울릉군 울릉읍
2950270,영주 무섬마을,http://tong.visitkorea.or.kr/cms2/website/70/2950270.jpg,"영주 무섬마을, 경상북도 영주시, 국가민속문화재 제278호, 체험마을, 섬계마을, 드론촬영, 드론사진, 항공촬영",경상북도 영주시,경상북도 영주시 문수면
2950260,희방폭포,http://tong.visitkorea.or.kr/cms2/website/60/2950260.jpg,"희방폭포, 경상북도 영주시, 소백산자락길, 소백산국립공원, 가을, 추경, 단풍, 드론촬영, 드론사진, 항공촬영",경상북도 영주시,경상북도 영주시 풍기읍
2950255,영주 비로사,http://tong.visitkorea.or.kr/cms2/website/55/2950255.jpg,"영주 비로사, 경상북도 영주시, 절, 사찰, 종교, 불교, 소백산자락길, 소백산국립공원, 가을, 추경, 단풍",경상북도 영주시,경상북도 영주시 풍기읍
2950251,죽계구곡,http://tong.visitkorea.or.kr/cms2/website/51/2950251.jpg,"죽계구곡, 경상북도 영주시, 계곡, 소백산자락길, 소백산국립공원, 가을, 추경, 단풍",경상북도 영주시,경상북도 영주시 순흥면
2950230,소수서원,http://tong.visitkorea.or.kr/cms2/website/30/2950230.jpg,"소수서원, 경상북도 영주시, 사적 제55호, 유네스코 세계문화유산, 유네스코 세계유산, 가을, 추경, 단풍, 드론촬영, 드론사진, 항공촬영",경상북도 영주시,경상북도 영주시 순흥면
2950174,구룡포 근대문화역사거리,http://tong.visitkorea.or.kr/cms2/website/74/2950174.jpg,"구룡포 근대문화역사거리, 경상북도 포항시, 구룡포 일본인 가옥거리, 동백꽃 필 무렵 촬영지, 드라마 촬영지, 한류",경상북도 포항시,경상북도 포항시 남구
2950160,호미곶 해맞이광장,http://tong.visitkorea.or.kr/cms2/website/60/2950160.jpg,"호미곶 해맞이광장, 경상북도 포항시, 공원, 해돋이 명소, 일출 명소, 포항 바다, 드론촬영, 드론사진, 항공촬영",경상북도 포항시,경상북도 포항시 남구
2949943,부용대,http://tong.visitkorea.or.kr/cms2/website/43/2949943.jpg,"부용대, 경상북도 안동시, 절벽, 기암괴석, 낙동강, 한복, 드론촬영, 드론사진, 항공촬영",경상북도 안동시,경상북도 안동시 풍천면
2826916,오륙도,http://tong.visitkorea.or.kr/cms2/website/16/2826916.jpg,"오륙도, 부산광역시 남구, 명승 제24호, 방패섬, 솔섬, 수리섬, 바다, 드론촬영, 드론사진, 항공촬영",부산광역시 남구,부산광역시 남구 용호동
2826907,부산 중앙공원,http://tong.visitkorea.or.kr/cms2/website/07/2826907.jpg,"부산 중앙공원, 부산광역시 동구, 대청공원, 테마공원, 충혼탑, 부산 전경, 드론촬영, 드론사진, 항공촬영",부산광역시 동구,부산광역시 동구 초량동
2826826,고하도 해상데크,http://tong.visitkorea.or.kr/cms2/website/26/2826826.jpg,"고하도 해상데크, 전라남도 목포시, 고하도 해안산책로, 산책길, 트레킹, 트래킹, 걷기여행, 드론촬영, 드론사진, 항공촬영",전라남도 목포시,전라남도 목포시 달동
2826700,목포 해상케이블카,http://tong.visitkorea.or.kr/cms2/website/00/2826700.jpg,"목포 해상케이블카, 전라남도 목포시, 드론촬영, 드론사진, 항공촬영",전라남도 목포시,전라남도 목포시 달동
2826665,목포 삼학도,http://tong.visitkorea.or.kr/cms2/website/65/2826665.jpg,"목포 삼학도, 전라남도 목포시, 섬, 드론촬영, 드론사진, 항공촬영",전라남도 목포시,전라남도 목포시 산정동
2826417,오목대,http://tong.visitkorea.or.kr/cms2/website/17/2826417.jpg,"오목대, 전라북도 전주시, 유적지, 슬로시티, 전주 전경, 드론촬영, 드론사진, 항공촬영",전라북도 전주시,전라북도 전주시 완산구
2826349,한국도로공사 전주수목원,http://tong.visitkorea.or.kr/cms2/website/49/2826349.jpg,"한국도로공사 전주수목원, 전라북도 전주시, 식물원, 수목원, 가을, 추경, 단풍, 드론촬영, 드론사진, 항공촬영",전라북도 전주시,전라북도 전주시 덕진구
2825906,안동 카페,http://tong.visitkorea.or.kr/cms2/website/06/2825906.jpg,"안동 카페, 경상북도 안동시, 안동 커피숍, 나예누리",경상북도 안동시,경상북도 안동시
2825867,안동간고등어,http://tong.visitkorea.or.kr/cms2/website/67/2825867.jpg,"안동간고등어, 경상북도 안동시, 간고등어구이, 자반고등어, 생선구이",경상북도 안동시,경상북도 안동시
2825701,안동 봉정사,http://tong.visitkorea.or.kr/cms2/website/01/2825701.jpg,"안동 봉정사, 경상북도 안동시, 절, 사찰, 불교, 종교, 유네스코 세계문화유산, 유네스코 세계유산, 산사, 한국의 산지 승원, 드론촬영, 드론사진, 항공촬영",경상북도 안동시,경상북도 안동시 서후면
2825661,안동 용계리 은행나무,http://tong.visitkorea.or.kr/cms2/website/61/2825661.jpg,"안동 용계리 은행나무, 경상북도 안동시, 천연기념물 제175호, 은행잎, 추경, 단풍, 드론촬영, 드론사진, 항공촬영",경상북도 안동시,경상북도 안동시 길안면
2825648,강릉 카페,http://tong.visitkorea.or.kr/cms2/website/48/2825648.jpg,"강릉 카페, 강원도 강릉시, 강릉 커피숍, 커피 원두",강원도 강릉시,강원도 강릉시
2825584,경포호,http://tong.visitkorea.or.kr/cms2/website/84/2825584.jpg,"경포호, 강원도 강릉시, 경호, 호수, 드론촬영, 드론사진, 항공촬영",강원도 강릉시,강원도 강릉시 저동
2820291,정남진전망대,http://tong.visitkorea.or.kr/cms2/website/91/2820291.jpg,"정남진전망대, 전라남도 장흥군, 장흥 전망대, 드론촬영, 드론사진, 항공촬영, 파노라마",전라남도 장흥군,전라남도 장흥군 관산읍
2820270,국사봉전망대,http://tong.visitkorea.or.kr/cms2/website/70/2820270.jpg,"국사봉전망대, 전라북도 임실군, 임실 전망대, 옥정호, 인공호수, 붕어섬, 드론촬영, 드론사진, 항공촬영, 파노라마",전라북도 임실군,전라북도 임실군 운암면
2820236,완도타워,http://tong.visitkorea.or.kr/cms2/website/36/2820236.jpg,"완도타워, 전라남도 완도군, 완도 전망대, 다도해일출공원, 드론촬영, 드론사진, 항공촬영",전라남도 완도군,전라남도 완도군 완도읍
2820087,고하도 전망대,http://tong.visitkorea.or.kr/cms2/website/87/2820087.jpg,"고하도 전망대, 전라남도 목포시, 목포 전망대, 드라마 촬영지, 꼰대인턴 촬영지, 목포해상케이블카, 드론촬영, 드론사진, 항공촬영, 파노라마",전라남도 목포시,전라남도 목포시 달동
2820007,빛가람전망대,http://tong.visitkorea.or.kr/cms2/website/07/2820007.jpg,"빛가람전망대, 전라남도 나주시, 나주 전망대, 빛가람 호수공원, 드론촬영, 드론사진, 항공촬영, 파노라마",전라남도 나주시,전라남도 나주시 빛가람동
2819963,대청호 로하스 캠핑장,http://tong.visitkorea.or.kr/cms2/website/63/2819963.jpg,"대청호 로하스 캠핑장, 대전광역시 대덕구, 대전 오토캠핑장, 드론촬영, 드론사진, 항공촬영, 파노라마",대전광역시 대덕구,대전광역시 대덕구 미호동
2819847,군위 화산마을 하늘전망대,http://tong.visitkorea.or.kr/cms2/website/47/2819847.jpg,"군위 화산마을 하늘전망대, 경상북도 군위군, 화산마을 전망대, 군위 전망대, 군위 화산산성 하늘전망대, 드론촬영, 드론사진, 항공촬영",경상북도 군위군,경상북도 군위군 삼국유사면
2819835,군위 화산마을 풍차전망대,http://tong.visitkorea.or.kr/cms2/website/35/2819835.jpg,"군위 화산마을 풍차전망대, 경상북도 군위군, 화산마을 전망대, 군위 전망대, 군위 화산산성 전망대, 드론촬영, 드론사진, 항공촬영, 파노라마",경상북도 군위군,경상북도 군위군 삼국유사면
2819822,느러지전망대,http://tong.visitkorea.or.kr/cms2/website/22/2819822.jpg,"느러지전망대, 전라남도 나주시, 나주 전망대, 영산강, 한반도 지형, 드론촬영, 드론사진, 항공촬영, 파노라마",전라남도 나주시,전라남도 나주시 동강면
2819780,광양 구봉산 전망대,http://tong.visitkorea.or.kr/cms2/website/80/2819780.jpg,"광양 구봉산 전망대 야경, 전라남도 광양시, 광양 전망대",전라남도 광양시,전라남도 광양시 성황동
2819632,진양호 호반 전망대,http://tong.visitkorea.or.kr/cms2/website/32/2819632.jpg,"진양호 호반 전망대, 경상남도 진주시, 진주 전망대, 드론촬영, 드론사진, 항공촬영",경상남도 진주시,경상남도 진주시 판문동
2819588,보현산댐 별빛 전망대,http://tong.visitkorea.or.kr/cms2/website/88/2819588.jpg,"보현산댐 별빛 전망대, 경상북도 영천시, 영천 전망대, 드론촬영, 드론사진, 항공촬영, 파노라마",경상북도 영천시,경상북도 영천시 화북면
2819573,영도 하늘전망대,http://tong.visitkorea.or.kr/cms2/website/73/2819573.jpg,"영도 하늘전망대, 부산광역시 영도구, 부산 전망대, 일몰, 석양, 드론촬영, 드론사진, 항공촬영, 파노라마",부산광역시 영도구,부산광역시 영도구 동삼동
2819454,태종대 전망대,http://tong.visitkorea.or.kr/cms2/website/54/2819454.jpg,"태종대 전망대, 부산광역시 영도구, 부산 전망대, 바다, 드론촬영, 드론사진, 항공촬영, 파노라마",부산광역시 영도구,부산광역시 영도구 동삼동
2818733,설리 스카이워크,http://tong.visitkorea.or.kr/cms2/website/33/2818733.jpg,"설리 스카이워크, 경상남도 남해군, 남해 전망대, 드론촬영, 드론사진, 항공촬영, 파노라마",경상남도 남해군,경상남도 남해군 미조면
2818483,병방치 스카이워크,http://tong.visitkorea.or.kr/cms2/website/83/2818483.jpg,"병방치 스카이워크, 강원도 정선군, 정선 전망대, 아리힐스, 동강, 드론촬영, 드론사진, 항공촬영",강원도 정선군,강원도 정선군 정선읍
2818462,우제봉전망대,http://tong.visitkorea.or.kr/cms2/website/62/2818462.jpg,"우제봉전망대, 경상남도 거제시, 거제 전망대, 거제도 해금강, 바위섬, 드론촬영, 드론사진, 항공촬영",경상남도 거제시,경상남도 거제시 남부면
2810723,양림동 선교사 묘지,http://tong.visitkorea.or.kr/cms2/website/23/2810723.jpg,"양림동 선교사 묘지, 광주광역시 남구, 무덤, 양림동 근대역사문화마을",광주광역시 남구,광주광역시 남구 양림동
2810903,화성 융릉과 건릉,http://tong.visitkorea.or.kr/cms2/website/03/2810903.jpg,"화성 융릉과 건릉, 경기도 화성시, 융건릉, 사적 제206호, 유네스코 세계문화유산, 유네스코 세계유산, 조선왕릉, 가을, 추경, 단풍, 산책길, 산책로",경기도 화성시,경기도 화성시 안녕동
2810890,국립아시아문화전당,http://tong.visitkorea.or.kr/cms2/website/90/2810890.jpg,"국립아시아문화전당, 광주광역시 동구, ACC, 전시관",광주광역시 동구,광주광역시 동구 광산동
2810847,동명동 카페거리,http://tong.visitkorea.or.kr/cms2/website/47/2810847.jpg,"동명동 카페거리, 광주광역시 동구, 이색거리, 광주 카페, 광주 커피숍",광주광역시 동구,광주광역시 동구 동명동
2810819,양림역사문화마을,http://tong.visitkorea.or.kr/cms2/website/19/2810819.jpg,"양림역사문화마을, 광주광역시 남구, 양림동 근대역사문화마을, 민속마을",광주광역시 남구,광주광역시 남구 양림동
2791668,백석탄계곡,http://tong.visitkorea.or.kr/cms2/website/68/2791668.jpg,"백석탄계곡, 경상북도 청송군, 백석탄 포트홀, 유네스코 세계지질공원, 청송 국가지질공원, 드론촬영, 드론사진, 항공촬영",경상북도 청송군,경상북도 청송군 안덕면
2791349,절골협곡,http://tong.visitkorea.or.kr/cms2/website/49/2791349.jpg,"절골협곡, 경상북도 청송군, 절골계곡, 응회암, 암석, 유네스코 세계지질공원, 청송 국가지질공원, 가을, 추경, 단풍, 산책로, 산책길, 트레킹, 트래킹, 걷기여행",경상북도 청송군,경상북도 청송군 주왕산면
2804494,청도읍성,http://tong.visitkorea.or.kr/cms2/website/94/2804494.jpg,"청도읍성, 경상북도 청도군, 성곽",경상북도 청도군,경상북도 청도군 화양읍
3043301,진도대교 일몰,http://tong.visitkorea.or.kr/cms2/website/01/3043301.jpg,"2023 대한민국 관광공모전(사진), 진도대교 일몰, 전라남도 해남군, 우수영관광지, 우수영국민관광지, 진도대교, 명량해상케이블카, 노을, 일몰",전라남도 해남군,전라남도 해남군 문내면
3043210,제주마방목지,http://tong.visitkorea.or.kr/cms2/website/10/3043210.jpg,"2023 대한민국 관광공모전(사진), 마방의 쌍무지개, 제주특별자치도 제주시, 제주도, 제주마방목지, 조랑말, 천연기념물 제347호, 쌍무지개, 자연",제주특별자치도 제주시,제주특별자치도 제주시 용강동
3043207,"굴업도, 개머리언덕",http://tong.visitkorea.or.kr/cms2/website/07/3043207.jpg,"2023 대한민국 관광공모전(사진), 황금빛 물결속으로, 인천광역시 옹진군, 굴업도, 섬, 개머리언덕, 수크령, 일출",인천광역시 옹진군,인천광역시 옹진군 덕적면
3043054,시흥갯골 생태구역,http://tong.visitkorea.or.kr/cms2/website/54/3043054.jpg,"2023 대한민국 관광공모전(사진), 몽환적인 가을아침, 경기도 시흥시, 시흥 갯골생태공원, 자연관광지, 자연생태관광지, 댑싸리, 일출, 드론촬영, 드론사진, 항공촬영",경기도 시흥시,경기도 시흥시 장곡동
3042944,태평염새식물원,http://tong.visitkorea.or.kr/cms2/website/44/3042944.jpg,"2023 대한민국 관광공모전(사진), 염생식물의 미, 전라남도 신안군, 태평염생식물원, 염생식물 군락지, 유네스코 생물권보전지역",전라남도 신안군,전라남도 신안군 증도면
2951112,아양기찻길,http://tong.visitkorea.or.kr/cms2/website/12/2951112.jpg,"아양기찻길, 대구광역시 동구, 아양철교, 교량, 드론촬영, 드론사진, 항공촬영",대구광역시 동구,대구광역시 동구 지저동
2951604,수성못 유원지,http://tong.visitkorea.or.kr/cms2/website/04/2951604.jpg,"수성못 유원지, 대구광역시 수성구, 수성유원지, 호수, 테마파크, 공원, 드론촬영, 드론사진, 항공촬영",대구광역시 수성구,대구광역시 수성구 두산동
2951599,앞산 해넘이전망대,http://tong.visitkorea.or.kr/cms2/website/99/2951599.jpg,"앞산 해넘이전망대, 대구광역시 남구, 대구 전망대, 야간 관광, 야경 명소, 일몰, 석양",대구광역시 남구,대구광역시 남구 대명동
2951829,디아크문화관,http://tong.visitkorea.or.kr/cms2/website/29/2951829.jpg,"디아크문화관, 대구광역시 달성군, 강정고령보, 강정보 디아크, 드론촬영, 드론사진, 항공촬영",대구광역시 달성군,대구광역시 달성군 다사읍
2951941,사문진 주막촌,http://tong.visitkorea.or.kr/cms2/website/41/2951941.jpg,"사문진 주막촌, 대구광역시 달성군, 테마공원, 산책로, 산책길, 낙동강, 드론촬영, 드론사진, 항공촬영",대구광역시 달성군,대구광역시 달성군 화원읍
2951954,계명대학교,http://tong.visitkorea.or.kr/cms2/website/54/2951954.jpg,"계명대학교, 대구광역시 달서구, 성서캠퍼스",대구광역시 달서구,대구광역시 달서구 신당동
2951671,이월드,http://tong.visitkorea.or.kr/cms2/website/71/2951671.jpg,"이월드, 대구광역시 달서구, 테마파크, 놀이공원, 놀이동산, 드론촬영, 드론사진, 항공촬영",대구광역시 달서구,대구광역시 달서구 두류동
2951564,앞산 카페거리,http://tong.visitkorea.or.kr/cms2/website/64/2951564.jpg,"앞산 카페거리, 대구광역시 남구, 이색거리, 대구 카페, 대구 커피숍",대구광역시 남구,대구광역시 남구 대명동
2951527,한방의료체험타운,http://tong.visitkorea.or.kr/cms2/website/27/2951527.jpg,"한방의료체험타운, 대구광역시 중구, 대구약령시",대구광역시 중구,대구광역시 중구 종로2가
2951359,대구아쿠아리움,http://tong.visitkorea.or.kr/cms2/website/59/2951359.jpg,"대구아쿠아리움, 대구광역시 동구, 수족관, 전시관",대구광역시 동구,대구광역시 동구 신천동
2949990,월영교,http://tong.visitkorea.or.kr/cms2/website/90/2949990.jpg,"월영교, 경상북도 안동시, 나무다리, 목책교, 월영정, 정자, 안동호, 야경",경상북도 안동시,경상북도 안동시 상아동
2949864,양동마을,http://tong.visitkorea.or.kr/cms2/website/64/2949864.jpg,"양동마을, 경상북도 경주시, 국가민속문화재 제189호, 중요민속자료, 유네스코 세계문화유산, 유네스코 세계유산, 전통마을, 민속마을, 한옥, 드론촬영, 드론사진, 항공촬영",경상북도 경주시,경상북도 경주시 강동면
2820587,하남 유니온파크,http://tong.visitkorea.or.kr/cms2/website/87/2820587.jpg,"하남 유니온파크, 경기도 하남시, 공원, 하남 유니온타워, 하남 전망대, 하남 전경, 드론촬영, 드론사진, 항공촬영, 파노라마",경기도 하남시,경기도 하남시 신장동
2810677,상주 도남서원,http://tong.visitkorea.or.kr/cms2/website/77/2810677.jpg,"상주 도남서원, 경상북도 상주시, 서당, 사액서원, 드론촬영, 드론사진, 항공촬영",경상북도 상주시,경상북도 상주시 도남동
2810671,경천섬공원,http://tong.visitkorea.or.kr/cms2/website/71/2810671.jpg,"경천섬공원, 경상북도 상주시, 근린공원, 생태공원, 낙동강, 드론촬영, 드론사진, 항공촬영",경상북도 상주시,경상북도 상주시 중동면
2804443,청도 와인터널,http://tong.visitkorea.or.kr/cms2/website/43/2804443.jpg,"청도 와인터널, 경상북도 청도군, 와이너리",경상북도 청도군,경상북도 청도군 화양읍
2804429,대구 근대골목,http://tong.visitkorea.or.kr/cms2/website/29/2804429.jpg,"대구 근대골목, 대구광역시 중구, 대구 근대골목투어, 대구 중구 근대로의 여행, 근대문화골목",대구광역시 중구,대구광역시 중구
2804426,전통대구약령시,http://tong.visitkorea.or.kr/cms2/website/26/2804426.jpg,"전통대구약령시, 대구광역시 중구, 대구약령시장, 대구한약재도매시장, 대구 근대골목투어, 대구 중구 근대로의 여행, 근대문화골목",대구광역시 중구,대구광역시 중구 동성로3가
2804425,영남대로,http://tong.visitkorea.or.kr/cms2/website/25/2804425.jpg,"영남대로, 대구광역시 중구, 한양가는 길, 과거길, 약령시 골목, 대구 근대골목투어, 대구 중구 근대로의 여행, 근대문화골목",대구광역시 중구,대구광역시 중구 동성로3가
2804417,구 교남 YMCA 회관,http://tong.visitkorea.or.kr/cms2/website/17/2804417.jpg,"구 교남 YMCA 회관, 대구광역시 중구, 국가등록문화재 제570호, 대구 근대골목투어, 대구 중구 근대로의 여행, 근대문화골목",대구광역시 중구,대구광역시 중구 성내2동
2804415,김원일의 마당깊은집,http://tong.visitkorea.or.kr/cms2/website/15/2804415.jpg,"김원일의 마당깊은집, 대구광역시 중구, 체험관광지, 문학 체험전시관, 대구 근대골목투어, 대구 중구 근대로의 여행, 근대문화골목",대구광역시 중구,대구광역시 중구 계산동2가
2787875,상주곶감공원,http://tong.visitkorea.or.kr/cms2/website/75/2787875.jpg,"상주곶감공원, 경상북도 상주시, 테마공원, 곶감 만들기, 초가집",경상북도 상주시,경상북도 상주시 외남면
2787788,학 전망대,http://tong.visitkorea.or.kr/cms2/website/88/2787788.jpg,"학 전망대, 경상북도 상주시, 상주 전망대, 낙강교, 일몰, 석양, 낙조, 노을",경상북도 상주시,경상북도 상주시 중동면
2787451,경천대 국민관광지,http://tong.visitkorea.or.kr/cms2/website/51/2787451.jpg,"경천대 국민관광지, 경상북도 상주시, 자천대, 경천대 전망대, 무우정",경상북도 상주시,경상북도 상주시 사벌국면
2787012,낙강교,http://tong.visitkorea.or.kr/cms2/website/12/2787012.jpg,"낙강교, 경상북도 상주시, 대교, 교량",경상북도 상주시,경상북도 상주시 중동면
2767928,상소동 산림욕장,http://tong.visitkorea.or.kr/cms2/website/28/2767928.jpg,"상소동 산림욕장, 대전광역시 동구, 자연휴양림, 산책로, 산책길, 걷기여행, 돌탑",대전광역시 동구,대전광역시 동구 상소동
2767902,계족산 황톳길,http://tong.visitkorea.or.kr/cms2/website/02/2767902.jpg,"계족산 황톳길, 대전광역시 대덕구, 장동산림욕장, 자연휴양림, 산책로, 산책길, 걷기여행",대전광역시 대덕구,대전광역시 대덕구 장동
3043209,도봉산 앞바다,http://tong.visitkorea.or.kr/cms2/website/09/3043209.jpg,"2023 대한민국 관광공모전(사진), 도봉산 앞바다, 서울특별시 도봉구, 도봉산, 북한산국립공원, 운무, 일출",서울특별시 도봉구,서울특별시 도봉구 도봉동
